abstract,author,cited,date,downed,download,fund,info,kws,source,title
摘要：目的 研究帕拉米韦及其拟肽类衍生物的大鼠小肠吸收机制，筛选出膜渗透性最大的衍生物.方法 采用大鼠在体单向灌流法研究帕拉米韦拟肽类衍生物的小肠吸收，采用高效液相色谱法测定药物和酚红的浓度.建立lgD预测值和lgP之间的关系.结果 帕拉米韦拟肽类衍生物的膜渗透系数都比帕拉米韦高，其中帕拉米韦L-异亮氨酸衍生物具有最高的膜渗透性;寡肽转运蛋白(PEPT1)典型底物甘氨酰肌氨酸能显著降低帕拉米韦拟肽类衍生物的小肠吸收，而L-缬氨酸不具有这种能力.结论 帕拉米韦拟肽类衍生物是PEPT1的底物，它们在大鼠小肠内的吸收是PEPT1介导的主动转运过程....,孙勇兵 涂亮星 甘薇 金一 胡律江,0,2011年,N/A,http://www.wanfangdata.com.cn/link.do?url=BE78DC6926613EC3C61D070E578356F9C0FCD10AD4DC13D1A570C0F65213F934E7333D88E62F5656E4482B654AA454D40449AC4FCB6C7DE60CD3398900D9ED97F3766DF88DEFB219EA93BC8A212E2213208A995C1FB7D019,N/A,N/A,N/A,万方期刊论文,在体单向肠灌流模型研究帕拉米韦拟肽类衍生物的大鼠小肠吸收特性
摘要：研究了不同初糖浓度、葡萄糖及氮的补加方式在L-异亮氨酸发酵过程中对其产酸率、转化率等参数的影响，确定了L-异亮氨酸补料分批发酵的最佳条件，在最佳补料分批发酵条件下，L-异亮氨酸产量达21.96 g/L，糖酸转化率迭15.34%....,宋文军,7,2011年,59,http://www.wanfangdata.com.cn/link.do?url=BE78DC6926613EC3C61D070E578356F9C0FCD10AD4DC13D1A570C0F65213F934E7333D88E62F5656E4482B654AA454D40449AC4FCB6C7DE622C97A5E962D6D0B22EEFB52B3C2D6AFFE7EE40C5C12A33A,N/A,N/A,N/A,万方期刊论文,L-异亮氨酸补料分批发酵的研究
摘要：目的:脂肪萎缩是引起糖脂代谢紊乱的重要因素之一.通过气相色谱-质谱联用(GC-MS)技术分析aP2-nSREBP-1c脂肪萎缩小鼠血浆代谢谱的变化，研究与其密切相关的差异代谢物与代谢通路，探讨其生物学基础.方法:应用GC-MS技术对6只同窝野生型小鼠和6只转基因小鼠血浆样品进行检测，对检测结果进行多元统计分析，筛选出显著差异的代谢物，借助MetaboAnalyst分析代谢通路.结果:与野生型(wild-type，WT)小鼠比较，转基因(transgenic，TG)小鼠血浆中乳酸、L-缬氨酸、3-羟基丁酸、尿素、d-半乳糖、D-阿洛糖、硬脂酸、棕榈酸、肌醇、油酸、11-十八碳烯酸含量增加.代谢通路富集分析发现3条脂肪萎缩相关通路.结论:通过对aP2-nSREBP-1c小鼠血浆代谢组学分析，发现缬氨酸、亮氨酸和异亮氨酸的生物合成，丙酮酸代谢，磷酸肌醇代谢途径与脂肪萎缩相关，为阐明糖脂代谢性疾病的发病机制提供了代谢组学依据....,吴琪 吴雅韵 韦世杰 余玉英 陈远云 荣向路 郭姣,0,2011年,42,http://www.wanfangdata.com.cn/link.do?url=BE78DC6926613EC3C61D070E578356F9C0FCD10AD4DC13D1A570C0F65213F934E7333D88E62F5656E4482B654AA454D40449AC4FCB6C7DE6905B5E2A39265CA87DDCFD46099562BEBC41EDC7369DC3BF,N/A,N/A,N/A,万方期刊论文,基于气相色谱-质谱的脂肪萎缩小鼠血浆代谢组学研究
摘要：采用热重-差热法对1-L-亮氨酸-1-脱氧-D-果糖(Ⅰ)和1-L-异亮氨酸-1-脱氧-D-果糖(Ⅱ)的热失重和热裂解温度进行了研究，通过在线裂解GC-MS联用技术分别对(Ⅰ)和(Ⅱ)在350℃、450℃、550℃、650℃、750℃和850℃条件下的裂解产物进行了鉴定.研究结果表明2种Amadori化合物的的热失重曲线相似，(Ⅰ)的裂解温度为144.67℃，(Ⅱ)的裂解温度为164.26℃，600℃时(Ⅰ)和(Ⅱ)失重约80%;二者裂解产物主要为吡嗪类、吡啶类、吡咯类、喹啉类和呋喃类等杂环化合物，芳香族化合物以及醛类和酮类，其中以毗嗪类为主;裂解产物的数量随着裂解温度的升高而增多，(Ⅰ)的裂解产物数量与(Ⅱ)的裂解产物数量相当.对(Ⅰ)和(Ⅱ)的主要裂解产物形成途径进行了初步探讨，可为研究其在卷烟燃烧过程中的转化行为提供参考....,毛多斌 鞠华波 牟定荣 白晓莉,8,2011年,100,http://www.wanfangdata.com.cn/link.do?url=BE78DC6926613EC3C61D070E578356F9C0FCD10AD4DC13D1A570C0F65213F934E7333D88E62F5656E4482B654AA454D40449AC4FCB6C7DE67926270CF98E56ECB2E838BD089D624E22191FC4854207F0,N/A,N/A,N/A,万方期刊论文,1-L-亮氨酸-1-脱氧-D-果糖和1-L-异亮氨酸-1-脱氧-D-果糖的热裂解分析
摘要：天然抗菌肽具有较强的杀菌能力，但其较高的细胞毒性会使肽的细胞选择性降低.为了提高抗菌肽的选择特异性，本研究拟探讨不同疏水性氨基酸对α-螺旋抗菌肽生物学活性的影响及其抑菌机制.笔者采用α-螺旋肽GRX2 RX3 RX2 RG作为模板，分别以疏水性氨基酸色氨酸(Try，W)、苯丙氨酸(Phe，F)、缬氨酸(Val，V)、丙氨酸(Ala，A)、亮氨酸(Leu，L)和异亮氨酸(Ile，I)来替换X位置，得到了一系列富含疏水氨基酸的肽GW、GF、GV、GI、GA和GL.本研究检测了抗菌肽的二级结构、溶血活性、抑菌活性、盐离子活性，并对其抑菌的作用机制进行了研究.结果 表明:通过CD光谱试验检测出GF、GI、GA和GL在细胞膜模拟环境中均表现出典型的α螺旋结构，而GV只在TFE中呈现α螺旋结构;溶血试验结果表明，GV和GA在浓度为128 μmol·L-1未表现出溶血活性，而其他肽均表现出较高的溶血活性;抑菌试验发现GV的最小抑菌浓度(MIC)的几何平均值为3.7 μmol·L-1，并具有最高的治疗指数(TI);盐离子稳定性试验表明，在NH4+、Zn2-和Fe3+中GV对大肠杆菌25922(E.coli ATCC 25922)的抑菌能力较稳定.进一步通过扫描电镜和内膜通透性试验对抗菌肽GV的抑菌机制进行分析，结果观察到GV能够通过穿透E coli ATCC 25922和金黄色葡萄球菌29213(S.aureusATCC29213)促使细胞内容物流出而导致细菌死亡，以及通过时间和剂量依赖的方式穿透细菌内膜.综合以上结果，富含Val的GV具有较高的细胞选择性和成为高效抗菌药物的发展潜力....,徐欣瑶 董娜 李欣然 杨洋 王志华 单安山,0,2011年,41,http://www.wanfangdata.com.cn/link.do?url=BE78DC6926613EC3C61D070E578356F9C0FCD10AD4DC13D1A570C0F65213F934E7333D88E62F5656E4482B654AA454D40449AC4FCB6C7DE6603A2EC5FA626A9FCBAE0EDF5610BF2BFA09D3C7A15AA5B2,N/A,N/A,N/A,万方期刊论文,不同疏水性氨基酸对α-螺旋抗菌肽生物学活性的影响
摘要：前期试验证明一定浓度褪黑素(melatonin，MT)预处理可以提高多年生黑麦草(Lolium perenne)的抗旱性.为进一步分析褪黑素预处理影响多年生黑麦草抗旱性的机理，在前期试验的基础上，分析了干旱胁迫条件下25 μmol·L-1MT预处理对多年生黑麦草抗氧化酶活性和代谢产物积累的影响.结果 表明，MT预处理显著延缓了多年生黑麦草草坪质量、光化学效率、相对含水量的下降速率以及相对电导率、丙二醛的上升速率.MT预处理通过提高干旱胁迫条件下多年生黑麦草超氧化物歧化酶、过氧化氢酶和过氧化物酶的活性，维持细胞内膜系统的稳定性.MT预处理也可能通过提高干旱胁迫条件下多年生黑麦草异亮氨酸、脯氨酸、鸟氨基、赤藓酮糖和葡萄糖胺等相关代谢产物的积累，增强多年生黑麦草的渗透调节能力和抗氧化能力，进而提高多年生黑麦草的抗旱性....,李本峰 杜红梅,0,2011年,19,http://www.wanfangdata.com.cn/link.do?url=BE78DC6926613EC3C61D070E578356F9C0FCD10AD4DC13D1A570C0F65213F934E7333D88E62F5656E4482B654AA454D40449AC4FCB6C7DE63A91A5D67A239F908293A4CB37B374FA401596A961D92AE1,N/A,N/A,N/A,万方期刊论文,褪黑素预处理提高多年生黑麦草抗旱性的机理分析
摘要：目的 建立中药珍珠层粉HPLC氨基酸指纹图谱，进行指纹图谱的模式识别研究，并测定珍珠层粉的氨基酸含量，为珍珠层粉质量评价提供依据;方法 采用Venusi1-AA氨基酸分析柱(4.6 mm×250 mm，5μm，柱号:AA952505-0)，柱温:28℃，进样量.10μL，波长:254 nm，流速:0.9 mL·min-1，以pH为6.5的醋酸钠水溶液为流动相A，以80％乙腈水溶液为流动相B.运用SAS和SPSS统计软件进行聚类分析和主成分分析，对珍珠层粉指纹图谱进行模式识别研究.结果 建立了珍珠层粉氨基酸指纹图谱，以及氨基酸指纹图谱的共有模式，检测出23个共有峰，并指认出其中15个共有峰相似度分析的结果与聚类分析和主成分分析保持一致，不同产地的珍珠层粉氨基酸成分差异不大，但不同基源的珍珠层粉氨基酸成分差异明显.本研究测定17个批次珍珠层粉中17种氨基酸(Asp天门冬氨酸、Glu谷氨酸、Ser丝氨酸、Gly甘氨酸、His组氨酸、Arg精氨酸、Thr苏氨酸、Ala丙氨酸、Pro脯氨酸、Tyr酪氨酸、Val缬氨酸、Met蛋氨酸、Cys胱氨酸、Ile异亮氨酸、Leu亮氨酸、Phe苯丙氨酸、Lys赖氨酸)的含量.结论 本研究建立的珍珠层粉氨基酸指纹图谱分析方法专属性强，及氨基酸含量测定方法简便易行、准确可靠，可对珍珠层粉的质量评价提供依据....,乔艺涵 孟雪丹 索亚然 刘雯雪 李二文 王昭懿 冯丹 柯尊洪 林瑞超 邹迪新,0,2011年,2,http://www.wanfangdata.com.cn/link.do?url=BE78DC6926613EC3C61D070E578356F9C0FCD10AD4DC13D1A570C0F65213F934E7333D88E62F5656E4482B654AA454D40449AC4FCB6C7DE6905B5E2A39265CA8D38B56154E95AE946118BE62EF271512E70C658D6D8A19A6,N/A,N/A,N/A,万方期刊论文,珍珠层粉氨基酸指纹图谱的构建及氨基酸含量测定的研究
摘要：研究了溶氧对Brevibacterium lactofermentation 分批发酵生产L-异亮氨酸(Ile)的影响，提出了前10 h 恒700 r/min 以维持溶氧在35% 以上，10 h 后调至600 r/min 以维持溶氧在15%～20% 的两阶段供氧控制模式.与对照相比，获得了较高的产率(0.094 g/g)和糖耗速度(4.76 g/L·h)，在较短时间内(52 h)获得较高的Ile产量(23.3 g/L)，比结果最好的单一搅拌转速(600 r/min)提高11.6% .生产强度(0.448 g/L·h)比恒定搅拌转速(500、600、700、800 r/min)控制下的过程分别提高了83.6%、28.7%、44.9%、35.7%.最后采用代谢通量分析对该结果产生的原因进行了定量解释....,彭志坚 房峻 李江华 堵国成 陈坚 宁健飞 蔡立明,5,2011年,211,http://www.wanfangdata.com.cn/link.do?url=BE78DC6926613EC3C61D070E578356F9C0FCD10AD4DC13D1A570C0F65213F934E7333D88E62F5656E4482B654AA454D40449AC4FCB6C7DE60CD3398900D9ED97FE1F148EFF932204F943F5F37F323E57,N/A,N/A,N/A,万方期刊论文,发酵法生产L-异亮氨酸的溶氧控制策略
摘要：本发明通过基因工程构建了一种L-异亮氨酸生产菌，保藏于中国典型培养物保藏中心，保藏编号为CCTCC?M?2015557。该L-异亮氨酸生产菌在发酵过程中能够实现发酵液中L-异亮氨酸的有效积累，具有较高的L-异亮氨酸产量及糖酸转化率，生产成本低，具有广泛的工业应用前景。,N/A,N/A,中国科学院上海生命科学研究院湖州工业生物技术中心,7,http://www.wanfangdata.com.cn/link.do?url=BE78DC6926613EC3C61D070E578356F9C0FCD10AD4DC13D1A570C0F65213F934E7333D88E62F5656E4482B654AA454D4312CDE92A525D0EC36CED29C7AFF897974B18A10346B2B832926EEF6B2516B08B201677D17A0C195,N/A,N/A,N/A,万方专利,L-异亮氨酸基因工程生产菌
摘要：目的 筛选高表达抗PD-1抗体的工程细胞株和较优的基础及补料培养基，并进行代谢分析. 方法 分别在TPP摇管、摇瓶中通过流加培养的方式，从6株细胞株和5种商业培养基中筛选高表达抗PD-1抗体的GS-CHO细胞株和较优的基础及补料培养基.在流加培养过程中，检测葡萄糖、谷氨酰胺、谷氨酸、乳酸及氨等的浓度变化.同时为分析限制性营养因素，进一步对乳酸、氨及氨基酸代谢进行分析. 结果 通过TPP摇管初步筛选，显示122和126两株细胞在HyCellCHO培养基中表现最好，表达量分别为1.945和1.989 g/L;在摇瓶中进一步验证显示122细胞在6株细胞中的最大活细胞密度图最高，达2.21×107 cells/mL，表达量＞2 g/L.代谢分析发现，乳酸代谢切换和谷氨酸及丙氨酸代谢相关.氨基酸分析发现，蛋氨酸、异亮氨酸、亮氨酸等必需氨基酸可能为122细胞株生长和(或)表达限制性成分. 结论 筛选出高表达抗PD-1抗体的细胞株和较优培养基，同时代谢分析和氨基酸分析为后续细胞培养工艺开发及个性化培养基优化提供理性指导....,梅文枫 朱一平 尹帮旗 许晓刚 方树彬,1,2011年,103,http://www.wanfangdata.com.cn/link.do?url=BE78DC6926613EC3C61D070E578356F9C0FCD10AD4DC13D1A570C0F65213F934E7333D88E62F5656E4482B654AA454D40449AC4FCB6C7DE662A62A28B791BD23BF92B6C9565B1C3DD52BAB3D9A1E2E8FB201677D17A0C195,N/A,N/A,GS-CHO细胞;培养基;细胞计数;代谢,万方期刊论文,高表达抗PD-1抗体CHO细胞株的筛选及代谢分析
摘要：本文对L-异亮氨酸产生茵YILW的发酵工艺条件做了研究，确定了其积累L-异亮氨酸的较为适宜的条件.分别研究并确定了其发酵时的最适接种量、最适宜供氧条件、发酵最适温度、最适pH以及最佳菌体浓度等条件.在此条件下，在5L发酵罐上发酵60h，L-异亮氨酸产量达到29.6g/L，糖酸转化率达到21%....,白亚磊 冯宁 徐庆阳 谢希贤 陈宁,1,2011年,65,http://www.wanfangdata.com.cn/link.do?url=BE78DC6926613EC3C61D070E578356F9C0FCD10AD4DC13D1A570C0F65213F934E7333D88E62F5656E4482B654AA454D40449AC4FCB6C7DE662A62A28B791BD239FB4A367D68A7AA3E8AEF9E90D5A5757,N/A,N/A,N/A,万方期刊论文,黄色短杆菌YILW生产L-异亮氨酸的发酵工艺研究
摘要：利用二烃基二氯化锡和新制的N-(5-氯亚水杨醛基)-L-异亮氨酸反应合成了三个新的二烃基锡N-(5-氯亚水杨醛基)-L-异亮氨酸酯，R2Sn[2-O-5-ClC6H3CH=NCH(s-Bu)COO] (R= Ph， 1;c-C6H11， 2;n-Bu， 3)，通过元素分析、IR、1H NMR及X-射线单晶衍射分析表征了其结构.化合物1属单斜晶系，P21空间群，中心锡原子具有畸变的三角双锥构型，与三齿配体形成了五元和六元两个螯合环.生物活性测试表明， 合成的三种化合物对大肠杆菌和金黄色葡萄球菌均有良好的抑制作用....,刘念丽 张纪云 于菲 于游 田来进,1,2011年,9,http://www.wanfangdata.com.cn/link.do?url=BE78DC6926613EC3C61D070E578356F9C0FCD10AD4DC13D1A570C0F65213F934E7333D88E62F5656E4482B654AA454D40449AC4FCB6C7DE6917B95F584BD5A07F43815BAE1F21ACF6F4E81D39E5CA350,N/A,N/A,N/A,万方期刊论文,二烃基锡N-(5-氯亚水杨醛基)-L-异亮氨酸酯的合成、结构及抑菌活性
摘要：目的 探讨代谢组学能否揭示早产儿并发坏死性小肠结肠炎(NEC)的早期生物标志物.方法 回顾分析和比较12例NEC早产儿以及23例日龄、体质量相仿的无NEC早产儿血浆中小分子物质和脂类代谢物.NEC早产儿于发病后l小时内收集血标本，采用1H-NMR方法检测血浆中小分子物质和脂类代谢物.结果 与对照组相比，NEC组β-羟基丁酸酯、琥珀酸、低密度脂蛋白/极低密度脂蛋白、多不饱和脂肪酸明显升高;异亮氨酸、亮氨酸、缬氨酸、丙氨酸、肌酸、苏氨酸明显降低;赖氨酸、谷氨酸、柠檬酸、酪氨酸、葡萄糖轻度降低;差异可完全区分.结论 NEC发病时即伴有与炎症通路有关的谷氨酸谷氨酰胺、酮体和丙氨酸代谢通路的异常，以及脂质代谢的紊乱.代谢组学方法可应用于早产儿NEC的研究....,陈佳楠 王礼周 吴谨准,2,2011年,66,http://www.wanfangdata.com.cn/link.do?url=BE78DC6926613EC3C61D070E578356F9C0FCD10AD4DC13D1A570C0F65213F934E7333D88E62F5656E4482B654AA454D40449AC4FCB6C7DE63E8660470B3A76A098DE635F7DB46A65B5C35341D7B06CBC,N/A,N/A,N/A,万方期刊论文,基于1H-NMR法的早产儿坏死性小肠结肠炎代谢组学研究
摘要：单分散亲水交联聚甲基丙烯酸环氧丙酯-甲基丙烯酸乙二醇双酯树脂(PGMA/EDMA)和手性配体L-异亮氨酸反应，再与铜离子进行配位，得到一种新型的L-异亮氨酸聚合物键合高效手性配体交换固定相. 在流动相为0.2 mol/L NaAc+0.1 mmol/L Cu(Ac)2水溶液和检测波长为254 nm条件下，固定相拆分了12种DL-氨基酸对映体，分离因子在1.23～2.33之间. 详细考察了流动相pH、流速及柱温等色谱条件对DL-氨基酸对映体拆分的影响，并探讨了拆分过程热力学. 结果表明，以单分散亲水性聚合物为基质的新型手性配体交换色谱固定相制备简单、操作方便、成本低廉，柱性能稳定. 在配体交换模式下，固定相对12种DL-氨基酸对映体进行了良好的拆分....,马桂娟 龚波林 阎超,13,2011年,107,http://www.wanfangdata.com.cn/link.do?url=BE78DC6926613EC3C61D070E578356F9C0FCD10AD4DC13D1A570C0F65213F934E7333D88E62F5656E4482B654AA454D40449AC4FCB6C7DE6D976EFA8C7ECEC75B64ECCA9A86BE5ADC2D15261A59328F2,N/A,N/A,N/A,万方期刊论文,L-异亮氨酸聚合物手性配体交换固定相的制备及对DL-氨基酸的拆分
摘要：本发明公开了一种提取L-异亮氨酸的工艺，其包括：1)混合发酵；2)过滤；3)浓缩重溶；4)离子交换。本发明工艺发酵效率高，提取技术简便、高效，具有广阔的市场前景。,N/A,N/A,2016-01-27,4,http://www.wanfangdata.com.cn/link.do?url=BE78DC6926613EC3C61D070E578356F9C0FCD10AD4DC13D1A570C0F65213F934E7333D88E62F5656E4482B654AA454D4312CDE92A525D0EC36CED29C7AFF897974B18A10346B2B83F648CC0FC3847791B201677D17A0C195,N/A,新疆阜丰生物科技有限公司,N/A,万方专利,一种提取L-异亮氨酸的工艺
摘要：本文对L-异亮氨酸的测定方法进行了研究，提出了薄层色谱法和高效液相色谱法定量测定L-异亮氨酸的方法，并对各方法的条件进行了系统研究....,张灿丽 崔冠明,4,2011年,62,http://www.wanfangdata.com.cn/link.do?url=BE78DC6926613EC3C61D070E578356F9C0FCD10AD4DC13D1A570C0F65213F934E7333D88E62F5656E4482B654AA454D40449AC4FCB6C7DE662A62A28B791BD23E971594AAB55BEC1907845420E0E8430,N/A,N/A,N/A,万方期刊论文,L-异亮氨酸检测方法研讨
摘要：设计了一种新型生物分子传感材料水溶性四苯乙烯-吡啶盐(Tpp4+)分子.为了模拟生物环境，将溶液酸碱度调至pH 7.4，用荧光光谱法研究了L-苯丙氨酸、L-色氨酸、L-异亮氨酸、L-组氨酸与Tpp4+分子的相互作用.研究结果发现，L-色氨酸对Tpp4+分子荧光有猝灭效应;根据不同温度下的Stern-Volmer曲线拟合得到，在T=298 K时，猝灭常数为355.2L/mol，而在T=308 K时，猝灭常数为825.4 L/mol;随着温度的升高，猝灭常数增大，由此判断猝灭机制为动态猝灭....,徐洲 梅高接 李亿保 范小林,0,2018年,N/A,http://www.wanfangdata.com.cn/link.do?url=BE78DC6926613EC3C61D070E578356F9C0FCD10AD4DC13D1A570C0F65213F934E7333D88E62F5656E4482B654AA454D40449AC4FCB6C7DE6E17676849563A34DA8BA576F6B354317E45B6B4134146B89,N/A,N/A,N/A,万方期刊论文,荧光光谱法研究富电子氨基酸与四苯乙烯-吡啶盐的相互作用
摘要：L-异亮氨酸作为必需氨基酸之一，广泛应用于医药、食品和饲料等领域.发酵法是目前生产L-异亮氨酸最主要的方法.文中分别从L-异亮氨酸的生产方法、生物合成及其代谢调控、代谢调控育种、发酵工艺的控制、提取精制方法、国内外生产现状等6个方面，对发酵法生产L-异亮氨酸的研究进展进行了综述....,李光霞 李宗伟 陈林海 汪杏莉 李宗义 秦广雍,11,2018年,257,http://www.wanfangdata.com.cn/link.do?url=BE78DC6926613EC3C61D070E578356F9C0FCD10AD4DC13D1A570C0F65213F934E7333D88E62F5656E4482B654AA454D40449AC4FCB6C7DE6905B5E2A39265CA8BFBC118CC9D06C11B4A8BC2EBBAC6317,N/A,N/A,N/A,万方期刊论文,发酵法生产L-异亮氨酸的研究进展
摘要：本发明涉及一种微生物酶转化法生产L‑4‑羟基异亮氨酸的方法，包括以下步骤：1、培养成熟的菌种；2、将成熟的可诱导生产L‑4‑羟基异亮氨酸的大肠杆菌重组菌接入发酵罐中，进行发酵培养，发酵过程温度两阶控制，前期温度4‑36℃，后期30‑32℃；3、发酵后收集菌体，加入磷酸盐缓冲液洗涤，再加入a‑酮戊二酸、异亮氨酸、硫酸亚铁、硫酸镁、抗坏血酸，强制通风催化；4、催化液先经过陶瓷膜除菌，超滤膜，活性炭脱色，弱酸性阳离子交换树脂除盐后，流出液上732阳离子交换树脂吸附并用氨水洗脱，蒸发浓缩、重结晶，得到L‑4‑羟基异亮氨酸。本发明制备方法的反应体系简单高效且提取流程简便易行，转化率高达95.4%以上，且产品纯度可达98%以上。,N/A,N/A,2016-07-20,10,http://www.wanfangdata.com.cn/link.do?url=BE78DC6926613EC3C61D070E578356F9C0FCD10AD4DC13D1A570C0F65213F934E7333D88E62F5656E4482B654AA454D4312CDE92A525D0EC36CED29C7AFF8979E9D9939B21621BE8792530C78992F4A4B201677D17A0C195,N/A,河南巨龙生物工程股份有限公司,N/A,万方专利,一种微生物酶转化法生产L-4-羟基异亮氨酸的方法
摘要：采用高效液相色谱-蒸发光散射检测器(HPLC-ELSD)定量测定发酵液中L-异亮氨酸的含量.结果表明，L-异亮氨酸浓度在0.960～2.880 g/L时，其峰面积(y)与相应的浓度(X)呈线性关系，线性方程为y=0.661 5X-0.243 9，相关系数为0.999 7.L-异亮氨酸的平均回收率为99.08%～101.3%，相对标准偏差为0.56%～1.32%.方法的精密度、准确度好，稳定性高，能简便、快速、准确地测定发酵液中L-异亮氨酸的含量....,万红贵 朱庆平 蔡恒 蔡立明 宁健飞 陆彬,9,2018年,68,http://www.wanfangdata.com.cn/link.do?url=BE78DC6926613EC3C61D070E578356F9C0FCD10AD4DC13D1A570C0F65213F934E7333D88E62F5656E4482B654AA454D40449AC4FCB6C7DE6905B5E2A39265CA8127645217C8E5D58CCBD5EBCB4671487,N/A,N/A,N/A,万方期刊论文,HPLC-ELSD法定量测定发酵液中的L-异亮氨酸
摘要：以栖糖蜜棒杆菌(Corynebacterium melassecola)ATCC17965为出发菌株，根据代谢控制发酵原理，经硫酸二乙酯和60Co诱变处理，定向选育出一株L-异亮氨酸产生菌I31-5(SGr+ Leu-MEr+Leu-+AHVr+Sucg+Ethr)，在培养基未经优化的情况下产L-异亮氨酸14～15 g/L.同时，考察了培养基及发酵条件对菌株产酸的影响，在优化的培养基和发酵条件下积累L-异亮氨酸19.2 g/L，最高时可达21.3 g/L....,李进 张伟国,8,2018年,134,http://www.wanfangdata.com.cn/link.do?url=BE78DC6926613EC3C61D070E578356F9C0FCD10AD4DC13D1A570C0F65213F934E7333D88E62F5656E4482B654AA454D40449AC4FCB6C7DE6E11CFAFBFB66F5D2D94C04089A24E89C81EDA38823929F63B201677D17A0C195,N/A,N/A,N/A,万方期刊论文,L-异亮氨酸菌种选育及发酵条件优化
摘要：[目的]研究酵母硒对围产期奶牛代谢的影响，从代谢物变化的角度阐述其在分娩应激状态下的生物学作用.[方法]选择24头体况、胎次、年龄、体质量和预产期相近的健康围产前期奶牛随机分为对照组和试验组，每组各12头，对照组饲喂基础日粮，试验组在基础日粮中添加0.15 g/kg干物质的酵母硒，于产前21d开始饲喂，分娩后当天停止饲喂.在产前21 d及分娩后6h内尾静脉采血，使用EDTA抗凝并离心收集血浆.应用UPLC-TOF/MS分析技术，在正负离子模式下对所有血浆样品进行代谢组学分析，数据经预处理后利用多维统计(包括主成分分析(principal component analysis，PCA)和正交偏最小二乘法判别分析(orthogonal partial least squares-discriminant analysis，OPLS-DA))和单变量(t检验和差异倍数)分析方法，分析在产前21 d和分娩当天试验组和对照组奶牛血浆中代谢物差异性，以OPLS-DA获得的VIP值＞1和t检验中P＜0.1为条件筛选差异代谢物.[结果]2组奶牛血浆代谢物在饲喂硒前差异不明显，饲喂硒后有19种差异代谢物.与对照组相比，试验组奶牛在分娩后血浆中L-苯丙氨酸、L-亮氨酸、异亮氨酸、L-谷氨酰胺、L-缬氨酸、酪胺、酮亮氨酸和硫酸吲哚酚显著降低(P＜0.05)，甜菜碱、7-甲基黄嘌呤、马尿酸、尿囊素和柠檬酸显著升高(P＜0.05)，L-正亮氨酸、DL-苯丙氨酸、乙二醇单乙醚和氧代己二酸呈降低趋势(0.05＜P＜0.1)，L-肌肽和苯乙酰甘氨酸呈升高趋势(0.05＜P＜0.1).[结论]在分娩应激状态下，硒可能通过影响氨基酸、脂类和尿嘌呤衍生物的代谢，发挥着抗应激反应的作用....,罗正中 白利鹏 黄逸馨 江婧 沈留红 陶金忠 余树民 曹随忠,1,2018年,45,http://www.wanfangdata.com.cn/link.do?url=BE78DC6926613EC3C61D070E578356F9C0FCD10AD4DC13D1A570C0F65213F934E7333D88E62F5656E4482B654AA454D40449AC4FCB6C7DE6603A2EC5FA626A9FE843C7F7B03BD13CBEEB197877C4A506B201677D17A0C195,N/A,N/A,N/A,万方期刊论文,酵母硒对分娩应激状态下围产期奶牛代谢的影响
