abstract,author,cited,date,downed,download,fund,info,kws,source,title
摘要：以解除了异亮氨酸反馈抑制作用的大肠杆菌N12为出发菌株，用硫酸二乙酯(DES)进行多轮随机诱变，筛选得到蛋氨酸、亮氨酸和赖氨酸营养缺陷型突变菌株大肠杆菌NMLL(Met-+Leu-+Lys-)，经测试其遗传性状稳定，并在研究葡萄糖、硫酸铵、玉米浆3个单因素试验的基础上，用Design Expert软件的Box-Behnken Design(BBD)建立响应面模型优化了此菌株的发酵条件.结果表明:经诱变育种后，未经优化条件下发酵48 h时，产酸量较菌株N12提高了46.2％.采用响应面法对大肠杆菌NMLL发酵条件进行优化，得到最佳条件为:葡萄糖116.40 g/L、玉米浆12.03mL/L、硫酸铵40.00 g/L、磷酸二氢钾0.05 g/L、MgSO4· 7H2O 2.5 g/L、FeSO4· 7H2O 0.01 g/L、CaCO32.0 g/L，在此条件下L-异亮氨酸的产量为4.62 g/L，与预测值(4.43 g/L)吻合度较高.通过发酵对比试验可见，优化后产酸量提高40.43％....,于丽男 刘慧燕 方海田 吴庆 王梦娇 张惠玲,0,2020年,N/A,http://www.wanfangdata.com.cn/link.do?url=BE78DC6926613EC3C61D070E578356F9C0FCD10AD4DC13D1A570C0F65213F934E7333D88E62F5656E4482B654AA454D40449AC4FCB6C7DE6905B5E2A39265CA868C57B9070B2933951EDCBBCABA4CA34,N/A,N/A,大肠杆菌;L-异亮氨酸;菌种选育;响应面;培养条件,万方期刊论文,L-异亮氨酸高产菌种的选育与响应面法优化发酵培养条件的研究
摘要：本发明涉及一种发酵提取L‑异亮氨酸的工艺，其包括如下步骤：步骤1)发酵制备L‑异亮氨酸，步骤2)脱色，步骤3)浓缩和粗结晶，步骤4)除杂和结晶，通过上述步骤制得高纯度的精品L‑异亮氨酸。本发明工艺发酵效率高，操作简单，自动化程度高，并且摒弃了传统的离子交换步骤、节能环保。,N/A,N/A,2018-07-17,12,http://www.wanfangdata.com.cn/link.do?url=BE78DC6926613EC3C61D070E578356F9C0FCD10AD4DC13D1A570C0F65213F934E7333D88E62F5656E4482B654AA454D4312CDE92A525D0EC36CED29C7AFF8979AA0E7E23A28D33E66BFAE498C02F5C4FB201677D17A0C195,N/A,新疆阜丰生物科技有限公司,N/A,万方专利,一种发酵提取L-异亮氨酸的工艺
摘要：以苹果属(Malus)植物沧江海棠(M.ombrophila Hand.-Mazz)的果实为材料，对其发育过程中苹果酸的含量进行测定，并结合转录组测序的方法筛选控制果实酸度的候选基因.结果 显示:MdPH1候选基因的编码区包含2829 bp，编码942个氨基酸;基因组序列全长为4269 bp，包含8个外显子和7个内含子.对10份苹果种质资源中PH1基因序列的分析结果表明，该基因序列中存在22个单核苷酸多态性(SNP)，其中13个位于内含子区，9个位于外显子区;位于最后一个外显子上SNP(G/A)的变异导致了编码氨基酸从缬氨酸变为异亮氨酸.MdPH1蛋白包含8个跨膜结构域，其中蛋白N端包含3个跨膜结构域，C端包含5个跨膜结构域.系统进化分析结果显示，苹果中的PH家族成员与梨(Pyrus communis L.)中的PH家族成员聚集成一簇.组织特异性表达结果发现，MdPH1基因在苹果果实中的表达量最高，其次是叶、花和根，茎中表达量最低.亚细胞定位分析表明MdPH1蛋白定位于液泡膜上....,齐彤辉 高萌 袁阳阳 李明军 马锋旺 马百全,0,2020年,N/A,http://www.wanfangdata.com.cn/link.do?url=BE78DC6926613EC3C61D070E578356F9C0FCD10AD4DC13D1A570C0F65213F934E7333D88E62F5656E4482B654AA454D40449AC4FCB6C7DE6E11CFAFBFB66F5D2CA9E458D6734E01DC7D8857E11462FDF,N/A,N/A,N/A,万方期刊论文,苹果酸度相关基因MdPH1的克隆、表达及亚细胞定位分析
摘要：为考察组成型过表达异亮氨酸羟化酶(isoleucine dioxygenase，IDO)基因ido对4-羟基异亮氨酸合成的影响，构建ido组成型表达质粒pXM01-ido及菌株HIL017，其ido转录量及IDO活性较诱导型过表达菌株HIL016显著提升，4-羟基异亮氨酸产量较HIL016提高19.4％.为进一步提高4-羟基异亮氨酸产量，通过Plackett-Burman试验确定HIL017发酵培养基中玉米浆、谷氨酸和FeSO4·7H2O用量为主要影响因素，利用最陡爬坡试验和响应面法确定其最优用量为玉米浆34.1 mL/L、谷氨酸2.98 g/L、FeSO4·7H2O 0.0167 g/L，此时4-羟基异亮氨酸理论产量为5.57 g/L.验证实验结果表明，最佳条件下4-羟基异亮氨酸产量为5.53 g/L，较优化前提高19.7％....,何继龙 李英滋 韩世宝 满德恩 郭脉海 战俊杰 张成林,0,2020年,5,http://www.wanfangdata.com.cn/link.do?url=BE78DC6926613EC3C61D070E578356F9C0FCD10AD4DC13D1A570C0F65213F934E7333D88E62F5656E4482B654AA454D40449AC4FCB6C7DE6905B5E2A39265CA802DF188E57F5EFBB5C7444A32769954F,N/A,N/A,N/A,万方期刊论文,组成型过表达ido基因对4-羟基异亮氨酸合成的影响及其发酵培养基的响应面优化
摘要：在pH 10.7的Kolthoff缓冲溶液中，钯(Ⅱ)能与吖啶红形成络合物从而使其荧光发生静态淬灭.当加入L-异亮氨酸后，L-异亮氨酸能与钯(Ⅱ)形成更为稳定的络合物而释放出吖啶红，使体系的荧光强度大幅增加.据此，提出了以钯(Ⅱ)与吖啶红形成的络合物作为荧光探针的荧光光谱法测定L-异亮氨酸的方法.激发和发射光谱通带宽度分别为5，10 nm，反应时间为120 min.L-异亮氨酸的线性范围为0.125～1.375 mg·L-1，方法的检出限(3s/k)为0.27 μg·L-1.L-异亮氨酸与钯(Ⅱ)的络合比为3比1.加标回收率在106％～114％之间，测定值的相对标准偏差(n=6)小于4.0％....,程定玺 朱会宇 刘起胜,0,2020年,20,http://www.wanfangdata.com.cn/link.do?url=BE78DC6926613EC3C61D070E578356F9C0FCD10AD4DC13D1A570C0F65213F934E7333D88E62F5656E4482B654AA454D40449AC4FCB6C7DE63E8660470B3A76A03C8A9AB4DE70A80F90B170E38E45F917,N/A,N/A,荧光光谱法;L-异亮氨酸;吖啶红;络合物,万方期刊论文,以钯(Ⅱ)与吖啶红形成的络合物作为荧光探针荧光光谱法测定L-异亮氨酸
摘要：苏氨酸脱水酶是细菌L-异亮氨酸合成途径中的关键酶，酶活力受终产物L-异亮氨酸的反馈抑制.苏氨酸脱水酶包含催化结构域及调控结构域，其中调控结构域所起的作用有待进一步研究.本文在大肠杆菌中分别克隆表达了四种不同的苏氨酸脱水酶:来自谷氨酸棒杆菌的苏氨酸脱水酶CgIlvA及其不含调控结构域的突变体CgIlvAM和来自大肠杆菌的苏氨酸脱水酶EcIlvA及其不含调控结构域的突变体EcIlvAM.通过蛋白纯化和酶活分析发现，CgIlvAM和EcIlvAM的酶活力比CgIlvA和EcIlvA的酶活力有所降低，但它们不再受L-异亮氨酸的反馈抑制，说明L-异亮氨酸对苏氨酸脱水酶的反馈抑制是通过其调控结构域来实现的....,于雪飞 尹良鸿 李烨 李颜颜 王小元,1,2020年,69,http://www.wanfangdata.com.cn/link.do?url=BE78DC6926613EC3C61D070E578356F9C0FCD10AD4DC13D1A570C0F65213F934E7333D88E62F5656E4482B654AA454D40449AC4FCB6C7DE60CD3398900D9ED9747DDA861F19AC505AC2FEFE263B07192,N/A,N/A,N/A,万方期刊论文,细菌苏氨酸脱水酶受L-异亮氨酸反馈抑制的关键在于其调控结构域
摘要：目的 研究噬菌体Guo1、Leo对不同模型休眠期结核分枝杆菌的裂解作用.方法 利用ClustalX软件作多重序列对比，寻找噬菌体Guo1、Leo的motif3基序.分别用缺氧模型及缺钾模型建模方法构建休眠期结核分枝杆菌模型.取缺氧及缺钾模型诱导的休眠期结核菌菌液，将其分别随机分成5组，每组设3个复管，每支试管装2 mL菌液.再向各组试管中分别加入100 μ，L的异烟肼(终浓度5μg/mL，异烟肼组)、利福平(终浓度5μg/mL，利福平组)、噬菌体Leo(滴度2.6×108 PFU/mL，Leo组)、噬菌体Guo1(滴度3.26×108 PFU/mL，Guo1组)，对照组加入等量ddH2O.利用最大可能数法，分别检测休眠期结核菌对异烟肼、利福平的耐药性及噬菌体对休眠期结核菌的裂解作用.结果 噬菌体Guo1、Leo的卷尺蛋白中均含有motif3基序，且其motif3基序含6个高度保守的氨基酸残基、1个高度保守的异亮氨酸-色氨酸位点.当作用于缺氧模型休眠期结核菌时，与利福平组、异烟肼组较较，Guo1组菌量明显减少(P＜0.05);当作用于缺钾模型休眠期结核菌时，与利福平组比较，Leo组菌量明显减少(P＜0.05).缺钾模型对异烟肼、利福平的耐药率明显高于缺氧模型.结论 相较于缺氧模型，缺钾模型能诱导结核菌进入更深的休眠状态.噬菌体Guo1对缺氧模型诱导的休眠期结核菌有裂解作用，噬菌体Leo对缺钾模型诱导的休眠期结核菌有裂解作用....,江莉莎 郭述良,0,2020年,0,http://www.wanfangdata.com.cn/link.do?url=BE78DC6926613EC3C61D070E578356F9C0FCD10AD4DC13D1A570C0F65213F934E7333D88E62F5656E4482B654AA454D40449AC4FCB6C7DE6D976EFA8C7ECEC75D1D7CBBA4B23F1992CEAC65931EA9815,N/A,N/A,噬菌体;休眠期结核菌;缺氧模型;缺钾模型;裂解作用,万方期刊论文,噬菌体Guo1、Leo对不同模型休眠期结核分枝杆菌的裂解作用
摘要：目的:建立UPLC-MS/MS法同时检测六合氨基酸注射液中6个有效成分(L-精氨酸、L-谷氨酸、L-门冬氨酸、L-亮氨酸、L-异亮氨酸和L-缬氨酸)的含量.方法:采用Agilent ZORBAX SB-C18(3.0mm×150 mm，5μm)色谱柱分离，以含0.2％甲酸和0.02％七氟丁酸的甲醇溶液-含0.2％甲酸和0.02％七氟丁酸的水溶液为流动相，梯度洗脱，流速0.4 mL· min-1，柱温50℃;以电喷雾离子源(ESI)，正离子扫描方式，多反应监测扫描模式进行定量分析.结果:所测6个氨基酸浓度在一定范围内呈良好的线性关系，r＞0.999 3;买验精密度、稳定性、重复性良好;平均加样回收率为95.8％～103.2％，RSD＜4.2％.10批样品中L-精氨酸、L-谷氨酸、L-门冬氨酸、L-亮氨酸、L-异亮氨酸和L-缬氨酸的含量检测结果分别为21.64～22.24、18.12～18.64、3.84～4.24、16.40～16.88、10.76～11.48和11.96～12.48 mg·mL-1.结论:经方法学验证，所建立的分析方法简便、快速、准确，灵敏度高，可作为六合氨基酸注射液的质量控制和评价方法....,王清华,0,2020年,N/A,http://www.wanfangdata.com.cn/link.do?url=BE78DC6926613EC3C61D070E578356F9C0FCD10AD4DC13D1A570C0F65213F934E7333D88E62F5656E4482B654AA454D40449AC4FCB6C7DE6D976EFA8C7ECEC75D2AFB772C7CE3C55548780E6C938F9D2,N/A,N/A,N/A,万方期刊论文,UPLC-MS/MS法同时测定六合氨基酸注射液中6个有效成分的含量
摘要：L-异亮氨酸是人和动物八种必需氨基酸之一，在生命活动中具有重要地位.乙酰羟基酸合成酶(acetohydroxyacid synthase，AHAS)是L-异亮氨酸合成途径的关键酶(由ilvBN编码)，α-酮基丁酸是L-异亮氨酸合成的重要前体.因此强化ilvBN的表达以及增加α-酮基丁酸的供应理论上可提高L-异亮氨酸的合成.cimA编码的甲基苹果酸合成酶可以催化丙酮酸和乙酰-CoA快速生成L-异亮氨酸前体α-酮基丁酸，从而增强主代谢流通量.本文采用基因重组手段将L-异亮氨酸生产菌株Corynebacterium glutamicum YILWilvBNC操纵子中的启动子替换为强启动子Ptac获得C.glutamicum YILWPtac.摇瓶发酵结果显示该菌株L-异亮氨酸产量和转化率分别较出发菌株提高了14.8％和18.6％.在此基础上过表达cimA基因，获得C glutamicum YILWPtacpXMJ 19cimA，其L-异亮氨酸酸产量和糖酸转化率分别较出发菌株提高了14.5％和42.4％.本研究可为氨基酸生产菌株的选育提供依据....,温冰 徐国栋 刘远 徐庆阳 谢希贤 张成林 陈宁,1,2020年,N/A,http://www.wanfangdata.com.cn/link.do?url=BE78DC6926613EC3C61D070E578356F9C0FCD10AD4DC13D1A570C0F65213F934E7333D88E62F5656E4482B654AA454D40449AC4FCB6C7DE60CD3398900D9ED97BE494E3626574F9223B6655FAF37CBD5B201677D17A0C195,N/A,N/A,N/A,万方期刊论文,ilvBNC操纵子协同cimA基因过表达提高Corynebacterium glutamicum YILW L-异亮氨酸产量的研究
摘要：建立了梯度淋洗-积分脉冲安培检测-离子色谱法测定果汁中20种氨基酸的方法，通过对流速、色谱柱温度、pH等实验影响因素的考察，探索出了适合20种组分测定的多级梯度淋洗条件.结果 表明，当流速为0.25mL/min，pH在5.5 ～ 7.0，柱温为30℃时，20种组分在0.05 ～ 2.50 mg/L浓度范围内具有良好的线性关系(R＞0.995).除了亮氨酸、异亮氨酸、色氨酸外，其他17种组分检出限均小于0.05mg/L;在0.20、0.50、2.00 mg/L三个添加浓度下，回收率为82.73％ ～ 107.39％，RSD在1.97％ ～ 8.72％范围内....,宋卫得 杜利君 高尧华 张传杰 尹相英 孙明芹,0,2020年,33,http://www.wanfangdata.com.cn/link.do?url=BE78DC6926613EC3C61D070E578356F9C0FCD10AD4DC13D1A570C0F65213F934E7333D88E62F5656E4482B654AA454D40449AC4FCB6C7DE67926270CF98E56EC3B2631A8282371965D049BA2696E0BC3,N/A,N/A,N/A,万方期刊论文,积分脉冲安培检测-离子色谱法同时测定果汁中20种氨基酸
摘要：目的 建立HPLC法测定雄蚕蛾中缬氨酸、异亮氨酸和亮氨酸的含量.方法 采用Kromasil C18色谱柱(150 mm×4.6mm，5μm)，以乙腈-0.1 mol·L-1醋酸钠溶液(用醋酸调节pH值至6.5)(7∶93)为流动相A，以乙腈-水(4∶1)为流动相B，进行梯度洗脱;检测波长为254 nm;柱温为43℃;流速为1.0 mL· min-1;异硫氰酸苯酯(PITC)柱前衍生化.结果 雄蚕蛾中缬氨酸、异亮氨酸和亮氨酸各组分线性关系良好;平均回收率为99.29％～100.13％，RSD值为1.22％～1.45％.结论 所建立的方法专属性强，重复性好，可用于雄蚕蛾药材的质量控制....,朱远锋 孙全明 朱清丽 熊贤锋 吴春燕 谭艳萍 王立鹏,0,2020年,11,http://www.wanfangdata.com.cn/link.do?url=BE78DC6926613EC3C61D070E578356F9C0FCD10AD4DC13D1A570C0F65213F934E7333D88E62F5656E4482B654AA454D40449AC4FCB6C7DE6603A2EC5FA626A9F29958F7E22731EF6FA09D3C7A15AA5B2,N/A,N/A,N/A,万方期刊论文,HPLC法测定雄蚕蛾中缬氨酸、异亮氨酸和亮氨酸的含量
摘要：建立了梯度淋洗-离子色谱-积分脉冲安培检测法同时测定酱油中20种氨基酸和6种糖的方法，通过对色谱柱温度、pH值、放置时间等实验影响因素的考察，探索出了适合26种组分测定的多级梯度淋洗条件.结果表明，当流速为0.25 mL/min，pH值在5.2～6.7，柱温在35℃时，26种组分在各自的浓度范围内具有良好的线性关系(r2≥0.995).除了谷氨酰胺、亮氨酸、异亮氨酸、蛋氨酸外，其他22种组分的检出限均小于0.03 mg/L;在0.20、0.50、2.00 mg/L 3个添加水平下，回收率为84.2％～109％，RSD为2.7％～7.8％.该方法高效、简便、灵敏、准确，可用于酱油中多种氨基酸和糖的同时测定以及掺假辨别技术研究....,宋卫得 苏征 惠希东 许崇龙 杜利君 张传杰,0,2020年,32,http://www.wanfangdata.com.cn/link.do?url=BE78DC6926613EC3C61D070E578356F9C0FCD10AD4DC13D1A570C0F65213F934E7333D88E62F5656E4482B654AA454D40449AC4FCB6C7DE6905B5E2A39265CA8F13F495DDA50FA3F3F57F8094D9C5543,N/A,N/A,N/A,万方期刊论文,离子色谱-积分脉冲安培检测法同时测定酱油中 20种氨基酸和6种糖
摘要：通过对L-异亮氨酸化合物进行扩展性研究及分子设计，本论文合成了四种含(2S，3S)-3-甲基-2-氯戊酰氧基的手性液晶单体(M1～M4)，然后再以六氯合铂酸为引发剂，将四种单体通过接枝聚合，获得了对应的聚硅氧烷类液晶高分子(P1～P4)，采用FT-IR、1 H-NMR与GPC表征了所合成的中间体、手性液晶单体及其聚合物的化学结构与分子量及分布，结果符合分子设计.此外，采用旋光仪测定了手性单体的旋光度，研究表明:它们均为右旋化合物，其比旋光度随化合物刚性的增加而降低，而对于端基相同、液晶核刚性大小接近的单体，其比旋光度比较接近....,李乌云塔娜 张文昌 张莹 胡建设,1,2020年,N/A,http://www.wanfangdata.com.cn/link.do?url=BE78DC6926613EC3C61D070E578356F9C0FCD10AD4DC13D1A570C0F65213F934E7333D88E62F5656E4482B654AA454D40449AC4FCB6C7DE60CD3398900D9ED978DA47EB019220572918AA7EA1CF2B6DD,N/A,N/A,L-异亮氨酸;液晶;手性单体;聚合物;合成,万方期刊论文,基于L-异亮氨酸衍生物的液晶单体及其聚合物的合成与结构表征
摘要：本发明涉及分离纯化技术领域，具体涉及一种发酵催化液中提取L‑4‑羟基异亮氨酸的方法。本发明采用微滤膜、超滤膜、离子交换等步骤纯化分离L‑4‑羟基异亮氨酸发酵催化液中的L‑4‑羟基异亮氨酸，提取体系简单高效且流程简便易行，其中，滤膜清液上732阳离子交换树脂吸附并用氨含1.2～1.5wt％的氨水洗脱，可降低成品中铵盐含量，提高纯度；一次结晶利用酒精醇沉，可以提高一次粗品收率达50％以上，二次结晶用酒精醇沉，不但可以提高成品收率达50％以上，而且可以使产品液相纯度得到明显提升，最终产品总收率可达50％且产品纯度在95％以上，该方法效率高，成本低，易于大规模产业化生产。,N/A,N/A,2018-07-20,6,http://www.wanfangdata.com.cn/link.do?url=BE78DC6926613EC3C61D070E578356F9C0FCD10AD4DC13D1A570C0F65213F934E7333D88E62F5656E4482B654AA454D4312CDE92A525D0EC36CED29C7AFF8979AE86885A70FE0056B7460D8F8C5B1482B201677D17A0C195,N/A,河南巨龙生物工程股份有限公司,N/A,万方专利,一种发酵催化液中提取L-4-羟基异亮氨酸的方法
摘要：目的:合成具有较强抗乙型肝炎病毒(HBV)活性与较高血浆稳定性的抗HBV前药——阿德福韦膦酸双L-异亮氨酸乙酯(YF-6).方法:以三-(异丙氧基)磷为反应起始原料，通过与2-氯乙基氯甲基醚经Arbuzov重排得到二异丙基(2-氯乙氧基)甲基膦酸酯(1)，而后(1)在四氯化碳溶液中经五氯化磷及三氯氧磷处理得到2-氯乙氧甲基二膦酰氯(2)，(2)再与N-Boc L-异亮氨酸羟乙基酯缩合得到双N-Boc L-异亮氨酸-2-氯乙氧甲基膦酸乙酯(3)，所得物在Cs2CO3/DMF条件下与腺嘌呤缩合得到阿德福韦膦酸双N-Boc L-异亮氨酸乙酯(4)，后者经15％ HCl/dioxane脱去Boc保护基得到目标化合物(YF-6)，采用核磁共振氢谱和质谱鉴定.结果:根据探寻到的目标化合物合成的路线，获得了目标化合物(YF-6)，且收率较高，合成的化合物及中间体均经过核磁共振氢谱与质谱进行了结构表征，确证结构与目标产物一致.结论:该合成方法具有较好的实用性....,李零 傅晓钟 董永喜,0,2020年,21,http://www.wanfangdata.com.cn/link.do?url=BE78DC6926613EC3C61D070E578356F9C0FCD10AD4DC13D1A570C0F65213F934E7333D88E62F5656E4482B654AA454D40449AC4FCB6C7DE60CD3398900D9ED97CB62011CA4A03AD0A8FEE5E473BB9F49,N/A,N/A,N/A,万方期刊论文,抗HBV前药阿德福韦膦酸双L-异亮氨酸乙酯的合成
摘要：以黄色短杆菌BF420为出发菌株，经过紫外线和亚硝基胍(NTG)复合诱变处理后，获得一株甲硫氨酸缺陷(Met-)及抗α-氨基丁酸(α-AB)的 L-异亮氨酸产生菌BM2610，该菌株在未进行优化的发酵条件下能够积累L-异亮氨酸的量为7.12g·L-1，比出发菌株BF420提高了122.5％....,沈加彬 罗磊 施碧红 施巧琴 黄祥峰 吴松刚,6,2020年,84,http://www.wanfangdata.com.cn/link.do?url=BE78DC6926613EC3C61D070E578356F9C0FCD10AD4DC13D1A570C0F65213F934E7333D88E62F5656E4482B654AA454D40449AC4FCB6C7DE6DB74E2E503B6248DBF52FA35D87858D788B023D9B019AC73B201677D17A0C195,N/A,N/A,N/A,万方期刊论文,L-异亮氨酸产生菌黄色短杆菌的选育
摘要：　　以苯酚和苯甲酰氯为原料，经酯化反应、Fries重排合成得到2-羟基二苯甲酮，再与L-异亮氨酸缩合，形成的Schiff碱经硼氢化钾还原，得到目标化合物2-羟基二苯甲酮缩L-异亮氨酸还原Schiff碱。其组成和结构已由熔点测定、红外光谱和元素分析等方法进行了表征。并探讨了该还原Schiff碱的最佳反应条件为：硼氢化钾用量为1.5当量，反应温度0-5℃，反应时间1 h。...,李龙龙 王瑞龙,1,2020年,21,http://www.wanfangdata.com.cn/link.do?url=BE78DC6926613EC3C61D070E578356F9C0FCD10AD4DC13D1A570C0F65213F934E7333D88E62F5656E4482B654AA454D40449AC4FCB6C7DE621431D5815D9147BDA83112EE5524246AFEBDEBA5AE7565A732138ECFD0204FE,N/A,N/A,N/A,万方期刊论文,2-羟基二苯甲酮缩L-异亮氨酸还原Schiff碱的制备
"摘要：为研究不同水平低粗蛋白质(CP)氨基酸平衡日粮对10～25 kg仔猪的生长性能、血液指标、营养物质表观养分消化率和腹泻率的影响，选取320头10 kg健康的""杜×长×大""三元杂交断奶仔猪，随机分为4个处理，每个处理4个重复，每个重复20头仔猪.对照组饲喂基础日粮，C P水平为20.1％，其他组饲喂低C P补充氨基酸日粮，C P水平分别为18.3％ 、14.9％ 、13.2％，除根据需要补充L-赖氨酸、D L-蛋氨酸、L-苏氨酸、L-色氨酸外，还补充L-缬氨酸、L-异亮氨酸、L-苯丙氨酸和L-组氨酸等，共计8种晶体氨基酸，各处理氨基酸水平均达到或超过N RC(1998)猪营养需要量标准，试验期24 d.结果显示:①20.1％CP组仔猪平均日增重(ADG)显著高于13.2％CP(P<0.05);各组间料重比(F/G)、平均采食量(ADFI)差异均不显著(P>0.05).②20.1％CP组仔猪血清尿素水平最高，13.2％CP最低，二者差异极显著(P<0.01);各组间总蛋白(TP)、白蛋白(ALB)、球蛋白(GLB)、白蛋白/球蛋白、胰岛素、血糖、免疫球蛋白(IgA)、IgG、IgM水平均差异不显著(P>0.05).③13.2％CP、14.9％CP组仔猪CP表观消化率极显著低于20.1％CP组(P<0.01);其余指标差异均不显著(P>0.05).④20.1％CP组仔猪腹泻率最高，13.2％CP组腹泻率最低，且差异显著(P<0.05).综上所述，日粮CP水平降低至14.9％ 时对仔猪的生长性能无不良影响;血清尿素水平、CP表观消化率均极显著对于对照组(20.1％CP)，仔猪腹泻率大大降低.因此10～25 kg断奶仔猪氨基酸平衡日粮C P水平可降低至14.9％，不影响仔猪的生长性能....",薛强 张鹤亮 李秀花 薛荣 王君 白延波,0,2020年,5,http://www.wanfangdata.com.cn/link.do?url=BE78DC6926613EC3C61D070E578356F9C0FCD10AD4DC13D1A570C0F65213F934E7333D88E62F5656E4482B654AA454D40449AC4FCB6C7DE67926270CF98E56ECCD2E94D9BE2F117A7CCE0703FBC5D728,N/A,N/A,N/A,万方期刊论文,低粗蛋白质氨基酸平衡日粮对仔猪生长性能、血液指标、营养物质表观消化率和腹泻率的影响
摘要：NAD激酶催化辅酶Ⅰ[NAD(H)]发生磷酸化，转变成辅酶Ⅱ [NADP(H)]，而还原态辅酶Ⅱ (NADPH)是L-异亮氨酸合成的必要辅因子.为了提高NADPH的供应，首先克隆了谷氨酸棒杆菌NAD激酶基因ppnK，并利用大肠杆菌-棒状杆菌诱导型穿梭表达载体pDXW-8和组成型穿梭表达载体pDXW-9在L-异亮氨酸合成菌——乳糖发酵短杆菌JHI3-156中进行表达.摇瓶发酵后，ppnK诱导表达菌JHI3-156/pDXW-8-ppnK的NAD激酶酶活(4.33±0.74 U/g)比pDXW-8空载菌提高了83.5％，辅酶Ⅱ与辅酶Ⅰ的比例提高了63.8％，L-异亮氨酸产量(3.86±0.12 g/L)提高了82.9％；ppnK组成表达菌JHI3-156/pDXW-9-ppnK的NAD激酶酶活(7.67±0.65 U/g)比pDXW-9空载菌提高了2.20倍，辅酶Ⅱ与辅酶Ⅰ的比例提高了1.34倍，NADPH含量提高了21.7％，L-异亮氨酸产量(2.99±0.18 g/L)提高了41.7％.这说明NAD激酶有助于辅酶Ⅱ的供应和L-异亮氨酸的生物合成，这对于其他氨基酸的生产也有一定的参考依据....,还晓静 李坤 史锋 王小元,6,2012年,N/A,http://www.wanfangdata.com.cn/link.do?url=BE78DC6926613EC3C61D070E578356F9C0FCD10AD4DC13D1A570C0F65213F934E7333D88E62F5656E4482B654AA454D40449AC4FCB6C7DE6905B5E2A39265CA8F4615BA551DC86A048F0D31245F530A0,N/A,N/A,L-异亮氨酸;NAD激酶;诱导型表达;组成型表达;乳糖发酵短杆菌,万方期刊论文,谷氨酸棒杆菌NAD激酶的过表达对L-异亮氨酸合成的促进作用
摘要：生长圈测定法是L-异亮氨酸高产菌筛选育种工作中较为简单、方便、经济、有效的一种测定方法。本文对影响生长圈法测定的检测培养基加入指示菌时温度、指示菌加入量、检测板琼脂浓度、琼脂块琼脂浓度等因素进行了研究。结果得到优化方法为测定平板和琼脂块均选用基本培养基;测定平板采用上层为10mL混菌培养基，下层为10mL基本培养基的双层平板，其琼脂浓度都为1%;琼脂块的琼脂浓度为1.5%;混菌平板中指示菌培养时间为18h，加入量为4%，混菌时最佳培养基温度为55℃。...,李宗伟 苏明杰 谈重芳 王雁萍 金庆生,0,2012年,N/A,http://www.wanfangdata.com.cn/link.do?url=BE78DC6926613EC3C61D070E578356F9C0FCD10AD4DC13D1A570C0F65213F934E7333D88E62F5656E4482B654AA454D40449AC4FCB6C7DE6905B5E2A39265CA84CF3E9B1FB9CBA7F0C34DA2097227946,N/A,N/A,L-异亮氨酸;生长圈法;钝齿棒杆菌;琼脂浓度,万方期刊论文,生长圈法应用于选育L-异亮氨酸菌株的条件优化
