abstract,author,cited,date,downed,download,fund,info,kws,source,title
摘要：为了提高L-异亮氨酸生产菌株Corynebacterium glutamicum LD320的产酸水平，通过改善其分泌系统，在C. glutamicum LD320中分别过表达突变型和野生型的双组份转运系统BrnFE操纵子，构建了重组菌LD320/pXMJ19-brnFE和LD320/pXMJ19-brnFE1。通过对两株重组菌的L-异亮氨酸生产分析比较，发现突变型比野生型能更有效地提高 L-异亮氨酸产量。同时对 LD320/pXMJ19-brnFE1进行表面活性剂添加实验，发现Tween-80为最佳选择，其最佳添加量为0.5 g/L，最佳添加时间为对数期的16 h。最后通过7 L发酵罐放大实验，LD320/pXMJ19-brnFE1的L-异亮氨酸产量由18.53 g/L提高到25.45 g/L，比对照组提高了37%。...,李忠财 董会娜 丛丽娜 张大伟,0,2020年,50,http://www.wanfangdata.com.cn/link.do?url=BE78DC6926613EC3C61D070E578356F9C0FCD10AD4DC13D1A570C0F65213F934E7333D88E62F5656E4482B654AA454D40449AC4FCB6C7DE60CD3398900D9ED977365D7CCA054C45959C3263DF43D8561,N/A,N/A,N/A,万方期刊论文,双组份转运系统BrnFE的过表达和表面活性剂的添加对谷氨酸棒杆菌发酵生产L-异亮氨酸的影响
"摘要：本研究旨在探讨饲粮添加异亮氨酸是否可以缓解轮状病毒(RV)感染对断奶仔猪回肠屏障功能的影响.在细胞试验中，用8 mmol/L的L-异亮氨酸处理IPEC-J2细胞24 h;在动物饲养试验中，选取28头健康的21日龄断奶的""杜×长×大""仔猪，采用2×2双因子设计，即饲粮处理(添加1％L-异亮氨酸饲粮或添加0.68％L-丙氨酸饲粮)和RV攻毒(灌服RV或无菌培养液)，RV攻毒于试验第15天早上进行.试验期为18 d.结果表明，L-异亮氨酸处理提高了IPEC-J2细胞中黏液蛋白2(mucin 2)、闭锁小带蛋白-1(ZO-1)和闭合蛋白(occludin)的mRNA相对表达量(P<0.05);RV攻毒提高了断奶仔猪平均腹泻指数和血清二胺氧化酶活性(P<0.05)，提高了回肠黏膜中RV的非结构蛋白4阳性率，降低了断奶仔猪回肠黏膜中mucin 2、ZO-1和occludin mRNA相对表达量(P<0.05);而饲粮添加异亮氨酸缓解了RV攻毒对断奶仔猪平均腹泻指数、血清二胺氧化酶活性和回肠黏膜mucin 2、ZO-1和occludin mRNA相对表达量的影响(P<0.05)，降低了回肠黏膜中RV的非结构蛋白4阳性率.综上所述，在断奶仔猪的饲粮中补充1％异亮氨酸可以预防RV诱导发生的腹泻，而这一作用与其可改善回肠屏障功能有关....",毛湘冰 古长松 陈代文 余冰 何军 郑萍 虞洁 罗钧秋 罗玉衡,0,2020年,4,http://www.wanfangdata.com.cn/link.do?url=BE78DC6926613EC3C61D070E578356F9C0FCD10AD4DC13D1A570C0F65213F934E7333D88E62F5656E4482B654AA454D40449AC4FCB6C7DE68F8CC7190CB846C2976D8D8880360FA78F59E2CA84F0D7A4,N/A,N/A,N/A,万方期刊论文,饲粮添加异亮氨酸对轮状病毒攻毒断奶仔猪回肠屏障功能的影响
摘要：本发明属于L‑异亮氨酸提取工艺领域，公开了一种利用色谱技术提取L‑异亮氨酸的方法，其包括如下步骤：步骤1)发酵，步骤2）过滤，步骤3）色谱纯化，步骤4）制备成品。本发明发酵效率高，提取过程中基本实现了L‑异亮氨酸与蛋白质、糖、无机盐、杂酸之间的彻底分离，提取过程全自动化，劳动强度低，生产成本降低，符合节能环保理念。,N/A,N/A,2019-05-24,1,http://www.wanfangdata.com.cn/link.do?url=BE78DC6926613EC3C61D070E578356F9C0FCD10AD4DC13D1A570C0F65213F934E7333D88E62F5656E4482B654AA454D4312CDE92A525D0EC36CED29C7AFF897918F6918C21D0C219B00A03024A56D9CCB201677D17A0C195,N/A,新疆阜丰生物科技有限公司,N/A,万方专利,一种利用色谱技术提取L-异亮氨酸的方法
摘要：苏氨酸脱水酶(TD)和乙酰羟基氨酸合酶(AHAS)是谷氨酸棒状杆菌(Corynebacterium glutamicum)合成L-异亮氨酸的关键酶.TD受L-异亮氨酸反馈抑制，AHAS受三支链氨基酸的反馈抑制.通过研究分析L-异亮氨生产菌C.glutamicum JHI3-156中突变型TD1及AHAS1，发现TD1有一个突变氨基酸，AHAS1有三个突变氨基酸;将TD，TD1，AHAS和AHAS1在Escherichia coli BL21 (DE3)中过量表达，经提取纯化及酶活测定，发现相比野生型TD，突变型TD1体现较高的酶活水平，完全不再受L-异亮氨酸反馈抑制;相比野生型AHAS，突变型AHAS1对较高浓度的L-异亮氨酸更耐受....,吴锦荣 李西君 刘世周 薄文文 王玉杰,2,2020年,24,http://www.wanfangdata.com.cn/link.do?url=BE78DC6926613EC3C61D070E578356F9C0FCD10AD4DC13D1A570C0F65213F934E7333D88E62F5656E4482B654AA454D40449AC4FCB6C7DE662A62A28B791BD239FB4A367D68A7AA39DCC1DAC5C551BEA,N/A,N/A,突变型TD1;突变型AHAS1;酶活测定;L-异亮氨酸;抗反馈抑制,万方期刊论文,L-异亮氨酸生产菌Corynebacterium glutamicum JHI3-156中突变酶TD1及AHAS1的初研究
摘要：以谷氨酸棒状杆菌（C orynebacterium glutam icum）为出发菌株，利用低能氮离子束注入对其进行多次诱变，结合异亮氨酸氧肟酸盐（IleH x）等氨基酸结构类似物定向筛选，得到一株稳定的高产L-异亮氨酸菌株：摇瓶培养72 h，产酸可达21~22 g/L，在50 L发酵罐上发酵51 h，产酸可达32 g/L。...,谢飞 崔国英 王翀 江兵 沈联兵 虞龙,3,2020年,45,http://www.wanfangdata.com.cn/link.do?url=BE78DC6926613EC3C61D070E578356F9C0FCD10AD4DC13D1A570C0F65213F934E7333D88E62F5656E4482B654AA454D40449AC4FCB6C7DE67926270CF98E56EC53F82D9B5EA069B68A8E08BF2358EF58,N/A,N/A,N/A,万方期刊论文,L-异亮氨酸高产菌种的选育研究
摘要：本发明公开了一种提高L‑异亮氨酸产量的方法，属于微生物发酵技术领域。本发明将发酵培养基中的传统氮源(如玉米浆等)替换为由豆饼粉、棉籽蛋白、麦芽汁、小麦胚芽粉以及干酪素按一定的比例配制而成的复合氮源以发酵生产L‑异亮氨酸；本发明的复合氮源可成功将以乳糖发酵短杆菌(Brevibacterium lactofermentation)发酵生产L‑异亮氨酸的产量从13g/L提高到18g/L。,N/A,N/A,2018-11-27,2,http://www.wanfangdata.com.cn/link.do?url=BE78DC6926613EC3C61D070E578356F9C0FCD10AD4DC13D1A570C0F65213F934E7333D88E62F5656E4482B654AA454D4312CDE92A525D0EC36CED29C7AFF8979AE86885A70FE00567BD659A208FC24EEB201677D17A0C195,N/A,无锡晶海氨基酸股份有限公司,N/A,万方专利,一种提高L-异亮氨酸产量的方法
摘要：本发明公开了一种高效生产L‑异亮氨酸的方法，属于微生物发酵技术领域。本发明以乳糖发酵短杆菌(Brevibacterium lactofermentation)作为L‑异亮氨酸的生产菌株，将乳糖发酵短杆菌(Brevibacterium lactofermentation)与北京棒杆菌(Corynebacterium pekinense)进行共培养，使得乳糖发酵短杆菌(Brevibacterium lactofermentation)的产酸能力显著提升，从13g/L提高到21g/L，已可满足工业化生产需求。,N/A,N/A,2018-11-20,4,http://www.wanfangdata.com.cn/link.do?url=BE78DC6926613EC3C61D070E578356F9C0FCD10AD4DC13D1A570C0F65213F934E7333D88E62F5656E4482B654AA454D4312CDE92A525D0EC36CED29C7AFF8979AE86885A70FE00566F24E1A49DD3E265B201677D17A0C195,N/A,无锡晶海氨基酸股份有限公司,N/A,万方专利,一种高效生产L-异亮氨酸的方法
摘要：本发明公开了一种产L‑异亮氨酸的谷氨酸棒杆菌(Corynebacterium glutamicum)基因工程菌，其在出发菌株基因组中敲除了编码二氨基庚二酸脱氢酶的ddh基因，所述ddh基因的核苷酸序列如SEQ ID No:2所示；插入了编码天冬氨酸激酶的lysC操纵子，所述lysC操纵子含lysC突变基因、其5’端的启动子和3’端的终止子，其中所述lysC突变基因的核苷酸序列如SEQ ID No:1所示；且所述出发菌株为保藏号为CCTCC NO:M2016609的C.glutamicum H5ΔargGΔalaT::ilvC。本发明还公开了所述基因工程菌的制备方法和应用。本发明所述基因工程菌L‑异亮氨酸的产量增加了5％，代谢支路的副产物赖氨酸的合成减弱了45.24％，降低了生产成本，具有广阔的工业应用前景。,N/A,N/A,2019-03-29,1,http://www.wanfangdata.com.cn/link.do?url=BE78DC6926613EC3C61D070E578356F9C0FCD10AD4DC13D1A570C0F65213F934E7333D88E62F5656E4482B654AA454D4312CDE92A525D0EC36CED29C7AFF897918F6918C21D0C219FCB9B86073117C4EB201677D17A0C195,N/A,武汉远大弘元股份有限公司,N/A,万方专利,一种产L-异亮氨酸的基因工程菌及其构建方法和应用
摘要：以黄色短杆菌BF420为出发菌株，经紫外线和亚硝基胍复合诱变处理后，单菌落分离筛选到一株营养缺陷型突变菌株BF35(Lys-).进一步采用氨基酸结构类似物S-2-氨基乙基-L-半胱氨酸(AEC)、α-氨基丁酸(α-AB)进行抗性筛选，获得一株带有遗传标记的L-异亮氨酸高产突变株BF3510(Lys-+AECr +a-ABr).该菌株在培养基未优化的条件下摇瓶产酸量为6.4g·L-1，比出发菌株增加了83％....,谢兰香 沈加彬 罗磊 施碧红 施巧琴 黄祥峰 吴松刚,1,2020年,67,http://www.wanfangdata.com.cn/link.do?url=BE78DC6926613EC3C61D070E578356F9C0FCD10AD4DC13D1A570C0F65213F934E7333D88E62F5656E4482B654AA454D40449AC4FCB6C7DE6DB74E2E503B6248DBF52FA35D87858D7FB2D926A22CB4928B201677D17A0C195,N/A,N/A,L-异亮氨酸;黄色短杆菌;诱变;育种,万方期刊论文,L-异亮氨酸产生菌的选育
摘要：本发明公开了一种提高L‑异亮氨酸产量的方法，属于微生物发酵技术领域。本发明以以钝齿棒杆菌(Corynebacterium crenatum)作为生产菌株，在以钝齿棒杆菌(Corynebacterium crenatum)的发酵培养基中添加脂肪酸和/或氯高铁血红素以提高其产酸水平，成功将以钝齿棒杆菌(Corynebacterium crenatum)产L‑异亮氨酸的产量从15g/L提高到了19g/L。,N/A,N/A,2018-11-13,0,http://www.wanfangdata.com.cn/link.do?url=BE78DC6926613EC3C61D070E578356F9C0FCD10AD4DC13D1A570C0F65213F934E7333D88E62F5656E4482B654AA454D4312CDE92A525D0EC36CED29C7AFF8979AE86885A70FE00568DDBB2A55B880A0CB201677D17A0C195,N/A,无锡晶海氨基酸股份有限公司,N/A,万方专利,一种提高L-异亮氨酸产量的方法
摘要：本申请涉及具有L‑异亮氨酸生产能力和包含具有柠苹酸合成酶活性的蛋白质的棒状杆菌属某种微生物，和通过使用其生产L‑异亮氨酸的方法。,N/A,N/A,2018-08-03,4,http://www.wanfangdata.com.cn/link.do?url=BE78DC6926613EC3C61D070E578356F9C0FCD10AD4DC13D1A570C0F65213F934E7333D88E62F5656E4482B654AA454D4312CDE92A525D0EC36CED29C7AFF8979AFB3E16CC55DC9A0F004F4A84E50DB3AB201677D17A0C195,N/A,CJ第一制糖株式会社,N/A,万方专利,具有L-异亮氨酸生产能力的棒状杆菌属某种微生物和使用其生产L-异亮氨酸的方法
摘要：本实验旨在研究生长中期花鲈对饲料L-异亮氨酸的需要量.选取初始体质量(159.33±1.20)g的花鲈为实验对象，在基础饲料中梯度添加晶体L-异亮氨酸，配制出异亮氨酸实测含量分别为0.72％、1.11％、1.53％、1.93％、2.31％和2.72％的6种饲料，在海水浮式网箱中进行10周养殖实验.实验结果表明，随饲料中L-异亮氨酸含量的升高，花鲈增重率(WGR)、饲料效率(FE)及蛋白质沉积率(PR)均呈现先上升后下降的趋势，各组间差异显著(P＜0.05)，且在1.93％L-异亮氨酸饲料组出现最大值，分别为108.55％、0.89、和37.57％.饲料中L-异亮氨酸含量对存活率(SR)、摄食率(FI)、肝体比(HSI)、脏体比(VSI)、肥满度(CF)、体组成和肌肉氨基酸组成均无显著影响(P＞0.05).肝脏谷草转氨酶(GOT)、谷丙转氨酶(GPT)活力随饲料中L-异亮氨酸含量的升高呈现先上升后下降的趋势，各组间差异显著(P＜0.05).饲料中L-异亮氨酸含量对血清甘油三酯(TG)含量有显著影响(P＜0.05)，在L-异亮氨酸含量为1.93％时达到最大值，显著高于0.72％和1.11％组(P＜0.05)，但与其他各组差异不显著(P＞0.05).饲料中L-异亮氨酸含量对血清谷草转氨酶(GOT)、谷丙转氨酶(GPT)活力、血清总胆固醇(TC)含量无显著影响(P＞0.05).以增重率(WGR)和蛋白质沉积率(PR)为评价指标，得出生长中期花鲈对饲料中L-异亮氨酸的需求量分别为1.88％和1.84％饲料干重，占饲料蛋白质的4.41％和4.32％....,路凯 徐玮 麦康森 王震 严晶 徐瀚林 艾庆辉,9,2020年,N/A,http://www.wanfangdata.com.cn/link.do?url=BE78DC6926613EC3C61D070E578356F9C0FCD10AD4DC13D1A570C0F65213F934E7333D88E62F5656E4482B654AA454D40449AC4FCB6C7DE6905B5E2A39265CA8A4E28BF5E5DDD072C7DBB55ED3B6BC73,N/A,N/A,N/A,万方期刊论文,生长中期花鲈对L-异亮氨酸需要量的研究
摘要：利用PCR介导的定点突变技术构建包含β4亚基的烟碱型乙酰胆碱受体点突变体模型，同时采用双电极电压钳技术，对激动剂ACh和拮抗剂α-CTx RegIIA对突变受体的活性进行检测.结果 表明:β4亚基胞外N端序列第168位的异亮氨酸(Ile)成功突变成了丝氨酸(Ser)，突变后的受体对激动剂ACh的活性降低，对拮抗剂α-CTx RegIIA的活性降低了1.4倍，半阻断剂量(IC50)为170 nmol·L-1....,张璐 朱晓鹏 长孙东亭 罗素兰,0,2020年,0,http://www.wanfangdata.com.cn/link.do?url=BE78DC6926613EC3C61D070E578356F9C0FCD10AD4DC13D1A570C0F65213F934E7333D88E62F5656E4482B654AA454D40449AC4FCB6C7DE6E17676849563A34D919528A1B55C63AB1D93947A90D84B24208A995C1FB7D019,N/A,N/A,N/A,万方期刊论文,烟碱型乙酰胆碱受体β4亚基点突变体的构建
摘要：本发明公开了一种L‑异亮氨酸对甲基苯磺酸一水合物晶体及其制备方法和用途，这种新化合物晶体含有1摩尔L‑异亮氨酸、1摩尔对甲基苯磺酸和1摩尔水，其制备方法是在含有L‑异亮氨酸的水溶液中加入对甲基苯磺酸一水合物或对甲基苯磺酸的水溶性盐，搅拌加热溶解，调节pH值为0.4～2.4后冷却该反应液，析出结晶，分离结晶和母液，再经真空干燥，得到L‑异亮氨酸对甲基苯磺酸一水合物晶体，其用途是用于制备高纯度L‑异亮氨酸，既能获得高纯度，又能获得高收率，关键物料(对甲基苯磺酸一水合物或对甲基苯磺酸的水溶性盐)可以循环利用，废水排放少，适合于工业化生产。,N/A,N/A,2019-03-01,0,http://www.wanfangdata.com.cn/link.do?url=BE78DC6926613EC3C61D070E578356F9C0FCD10AD4DC13D1A570C0F65213F934E7333D88E62F5656E4482B654AA454D4312CDE92A525D0EC36CED29C7AFF897918F6918C21D0C21915A0BF59CB7A4B5AB201677D17A0C195,N/A,宜昌三峡普诺丁生物制药有限公司,N/A,万方专利,L-异亮氨酸对甲基苯磺酸一水合物晶体及其制备方法和用途
摘要：目的 分析新生大鼠坏死性小肠结肠炎(necrotizing enterocolitis，NEC)肠道内容物代谢轮廓的变化和特征，探讨潜在的NEC生物标志物.方法 新生3日龄大鼠均采用特殊配方奶(15 g雀巢早产儿奶粉加入75 ml Pat-Ag幼犬专用奶中配制而成)喂养，随机分为对照组(n=8)及NEC组(n=12)，NEC组以3次/d，连续3d进行4℃冷刺激10 min +95％ N2缺氧10 min诱导建立.造模结束后处死所有大鼠，回结肠部位的肠道内容物以灌流方式取出，冻干后进行基于超高效液相色谱-组合型四级杆Orbitrap质谱仪(UHPLC-QE-MS)的非靶向代谢物检测，并用SIMCA软件对代谢物测定结果进行多元变量统计分析;回肠组织切片进行苏木精-伊红染色并行病理评分.结果 NEC组病理评分显著高于对照组[(3.13±0.83)分比(0.25±0.46)分，P＜0.001]，正离子扫描(ESI+)模式下正交偏最小二乘判别分析(OPLS-DA)模型R2(x)=0.604，R2(y)=0.583，Q2=0.960，负离子扫描(ESI-)模式下OPLS-DA模型R2(x) =0.828，R2(y) =0.999，Q2 =0.713，对照组和NEC组大鼠肠内容物代谢轮廓存在显著差异.对照组和NEC组之间存在48个差异代谢物，其中ESI-模式筛选出22个差异代谢物，包括L-别异亮氨酸(+221％)、D-苯丙氨酸(+230％)、L-组氨酸(+284％)、黄嘌呤(+207％)、谷氨酰亮氨酸(+246％)、阿洛糖(-70％)、肉豆蔻酸(-57％)和十五烷酸(-35％)等;ESI+模式下筛选出26个差异代谢物，包括鸟氨酸(+268％)、D-亮氨酸(+176％)、L-异亮氨酸(+213％)、乙酰胆碱(+195％)、烟酰胺腺嘌呤二核苷酸(+199％)、瓜氨酸(+158％)、胞嘧啶(-58％)、黄尿酸(-64％)等.差异代谢物进行京都基因与基因组百科全书(KEGG)分析可映射到33条不同的代谢通路，MetaboAnalyst软件的通路富集分析和通路拓扑分析表明精氨酸和脯氨酸代谢通路、组氨酸代谢通路和谷胱甘肽代谢通路在NEC组出现较大扰动.结论 NEC大鼠肠内容物代谢轮廓显著偏离于正常大鼠，以氨基酸蓄积为主要特征，主要涉及精氨酸、脯氨酸、组氨酸和谷胱甘肽代谢通路.检测肠内容物代谢组尤其是氨基酸代谢组对NEC诊断可能有重要意义，改善肠道微环境可能是防治NEC的关键策略....,张雯婷 薛鹏 姜春红 周晓鹰 郝武娟 余梦秋 屠文娟,0,2020年,N/A,http://www.wanfangdata.com.cn/link.do?url=BE78DC6926613EC3C61D070E578356F9C0FCD10AD4DC13D1A570C0F65213F934E7333D88E62F5656E4482B654AA454D40449AC4FCB6C7DE6603A2EC5FA626A9F8AC8F9ABBF944C879BF94302E6572476,N/A,N/A,N/A,万方期刊论文,新生大鼠坏死性小肠结肠炎肠道内容物非靶向代谢组学研究
摘要：[目的]克隆并表达来源于苏云金芽孢杆菌(Bacillus thuringiensis)TCCC 11826的L-异亮氨酸羟化酶(L-isoleucine-4-hydroxylase，IDO)，测定重组IDO酶学特性并构建用于4-羟基异亮氨酸(4-Hydroxyisoleucine，4-HIL)微生物转化的重组菌株，以考察该酶在4-HIL合成中的潜在应用价值.[方法]以B.thuringiensis TCCC 11826基因组为模板PCR扩增ido基因并构建该基因过表达菌株BL-IDO;采用Ni-NTA亲和层析法分离纯化重组IDO后检测其酶学特性;构建重组株菌W3110-IDO进行4-HIL的微生物转化.[结果]克隆B.thuringiensis TCCC 11826的ido基因，测序结果显示该基因含723个核苷酸，编码240个氨基酸，与已报道的B.thuringiensis 2-e-2的ido基因相似度分别为97.47％和97.91％.此IDO含有His1-X-Asp/Glu-Xn-His2基序，属于Fe2+和α-酮戊二酸依赖型羟化酶家族;酶学实验表明该酶能够特异性地催化L-异亮氨酸生成(2S，3R，4S)-4-HIL，其Km和Vmax分别为0.18 mmol/L和2.10μmol/min/mg，最适反应温度和pH分别为35℃和7.0，该酶于35℃条件下放置5h后仍具有85.1％的活性;在Escherichia coli W3110中过表达重组IDO，在未经优化条件下4-HIL最高转化率达89.28％.[结论]获得IDO编码基因序列(Accession No.KC884243)并首次较为系统地研究了其酶学特性，该酶反应条件温和且具有较高的活性及稳定性，在酶法或微生物转化法合成4-HIL中有较广泛的应用价值.本研究可为4-HIL及其它氨基酸衍生物的生物制造技术奠定理论基础....,张成林 刘远 薛宁 王鑫鑫 谢希贤 徐庆阳 陈宁,4,2020年,N/A,http://www.wanfangdata.com.cn/link.do?url=BE78DC6926613EC3C61D070E578356F9C0FCD10AD4DC13D1A570C0F65213F934E7333D88E62F5656E4482B654AA454D40449AC4FCB6C7DE6E11CFAFBFB66F5D2C167C63212D4B9BD0D97A1B50BCAE77E,N/A,N/A,N/A,万方期刊论文,苏云金芽孢杆菌重组L-异亮氨酸羟化酶的酶学性质及其在4-羟基异亮氨酸合成中的应用
摘要：目的 研究宽筋藤(中华青牛胆Tinospora sinensis藤茎)的化学成分.方法 利用硅胶、Sephadex LH-20等柱色谱和半制备HPLC等进行分离和纯化，根据波谱数据和理化性质对化合物的结构进行鉴定.结果 从宽筋藤的正丁醇萃取部位中分离得到16个化合物，分别鉴定为紫丁香苷(1)、corchoionoside C(2)、3，4-二甲氧基苯基-β-D-吡喃葡萄糖苷(3)、肉桂醇-O-β-D-吡喃葡萄糖苷(4)、3，4，5-二甲氧基苯酚-β-D-吡喃葡萄糖苷(5)、benzyl-β-D-glucopyranoside (6)、丁香酸(7)、3，5-二甲氧基苯甲酸-4-O-β-D-葡萄糖苷(8)、1，4-dihydroxymethyl-2，5-dimethoxy benzene (9)、l-[2-(furan-2-yl)-2-oxoethyl]pyrrolidin-2-one (10)、cordysinin B(11)、lyciumide A(12)、酪氨酸(13)、环(亮氨酸-异亮氨酸)(14)、表丁香树脂醇(15)、(+)-syringaresinol-4'O-β-D-glucopyranoside (16).结论 化合物2、9～14均为首次从青牛胆属植物中分离得到....,詹煌 陈佳倩 朱梦贞 张火娥 万思媛 黄丽萍 黄慧莲,0,2020年,N/A,http://www.wanfangdata.com.cn/link.do?url=BE78DC6926613EC3C61D070E578356F9C0FCD10AD4DC13D1A570C0F65213F934E7333D88E62F5656E4482B654AA454D40449AC4FCB6C7DE67926270CF98E56EC5C4B84DF65C2BAD8F07881D13B46793C,N/A,N/A,N/A,万方期刊论文,宽筋藤正丁醇部位的化学成分研究
摘要：目的:探讨1例家族性男性性早熟(familial male-limited precocious puberty，FMPP)患儿的临床特征，并对黄体生成素/人绒毛膜促性腺激素受体(luteinizing hormone/choriogonadotropin receptor，LHCGR)基因进行突变分析.方法:收集1例2岁5个月FM PP患儿的临床资料，包括性征、实验室相关检查结果等，并对患儿及其父母外周血白细胞L HCGR基因的11个外显子编码区进行测序.结果:患儿身高98 cm，双侧睾丸3.5 mL，阴茎长7 cm、横径2 cm，阴毛PH2期;血睾酮3.09ng/mL，促黄体生成素基础值<0.1mU/mL，卵泡刺激素基础值0.2mU/mL，促性腺激素释放激素激发试验中促黄体生成素峰值0.88 mU/mL、卵泡刺激素峰值1.35 mU/mL，符合外周性性早熟表现.进一步行PCR扩增片段测序显示，LHCGR基因第11外显子1723A>C突变，导致575位氨基酸残基由异亮氨酸变为亮氨酸.患儿母亲检测到相同的基因突变位点，但未出现青春期发育异常.结论:FM PP是外周性性早熟罕见病因，本病例有典型的临床表现，检测发现L HCGR基因杂合突变c.1723A>C(p.Ile575Leu)，母子具有相同基因型但表型不同，可能与女性雌激素的产生和卵泡发育需要LH和FSH的共同参与及青春期前女性性腺上不表达或低表达L HCGR有关....,杨海花 陈永兴 卫海燕,0,2020年,2,http://www.wanfangdata.com.cn/link.do?url=BE78DC6926613EC3C61D070E578356F9C0FCD10AD4DC13D1A570C0F65213F934E7333D88E62F5656E4482B654AA454D40449AC4FCB6C7DE67926270CF98E56EC5DB5793E656C9AA4891B733188C09F7F,N/A,N/A,N/A,万方期刊论文,LHCGR基因突变所致家族性男性性早熟家系分析
摘要：氯化石蜡(chlorinated paraffins，CPs)在中国大量生产和使用，导致其在环境介质中的含量较高.采用拟靶向代谢组学技术，比较研究了短、中和长链氯化石蜡在人体内暴露水平下(100μg·L-1)对HepG2细胞代谢的影响.结果表明，短、中和长链氯化石蜡暴露引起了HepG2细胞增殖活力的降低与代谢活动的显著变化.短链氯化石蜡(SCCPs)暴露对细胞代谢的影响强度略高于中链氯化石蜡(MCCPs)和长链氯化石蜡(LCCPs).3种氯化石蜡均显著扰乱了脂质代谢，且影响程度相近.显著受影响的代谢通路包括:甘油磷脂代谢、亚油酸代谢、α-亚麻酸代谢、花生四烯酸代谢和鞘磷脂代谢.同时，3种氯化石蜡暴露也显著扰乱了甘氨酸、丝氨酸和苏氨酸代谢，缬氨酸、亮氨酸和异亮氨酸生物合成，牛磺酸和亚牛磺酸代谢;此外，LCCPs还扰乱了苯丙氨酸、酪氨酸和色氨酸生物合成通路.相比于SCCPs和MCCPs，LCCPs对氨基酸代谢表现出更强的干扰效应....,任晓倩 张海军 耿柠波 王菲迪 张保琴 罗云 陈吉平,0,2020年,0,http://www.wanfangdata.com.cn/link.do?url=BE78DC6926613EC3C61D070E578356F9C0FCD10AD4DC13D1A570C0F65213F934E7333D88E62F5656E4482B654AA454D40449AC4FCB6C7DE63A91A5D67A239F907F714FD5A83EF21F893385520BCA330F,N/A,N/A,N/A,万方期刊论文,短、中、长链氯化石蜡暴露对细胞代谢影响的比较研究
摘要：L-异亮氨酸是人体必需氨基酸之一，具有很大的商业价值.在谷氨酸棒杆菌中，合成一分子L-异亮氨酸需要消耗四分子NADPH.因此，提高胞内NADPH浓度是提高L-异亮氨酸产量的重要手段之一.在乳糖发酵短杆菌JHI3-156中过量表达酿酒酵母的NADH激酶编码基因POS5△MTS，发酵48 h表达菌株JHI3-156/pDXW-10-POS5△MTS的胞内NADP+浓度增加了27μmol/L(17％)，NADPH浓度增加了36 μmol/L (96％);发酵72 h后L-异亮氨酸产量是(3.02±0.52)g/L，比对照菌(1.96±0.04) g/L提高了54％.本研究表明，过表达POS5△MTS基因能提高NADPH的供应，促进了L-异亮氨酸的生物合成....,李坤 还晓静 史锋 王小元,1,2020年,86,http://www.wanfangdata.com.cn/link.do?url=BE78DC6926613EC3C61D070E578356F9C0FCD10AD4DC13D1A570C0F65213F934E7333D88E62F5656E4482B654AA454D40449AC4FCB6C7DE60CD3398900D9ED9747DDA861F19AC505EB86E3965DA0A036,N/A,N/A,N/A,万方期刊论文,酿酒酵母POS5基因过表达对L-异亮氨酸合成的促进作用
