abstract,author,cited,date,downed,download,fund,info,kws,source,title
摘要：该实验考察和比较增强回补途径对谷氨酸棒状杆菌合成L-异亮氨酸的影响.通过以L-异亮氨酸生产菌Corynebacterium glutamicum YI为出发菌株，分别采用基因组整合和质粒的方式过表达磷酸烯醇式丙酮酸羧化酶编码基因ppc及丙酮酸羧化酶编码基因pyc.结果表明，获得pyc基因组整合和质粒过表达菌株ILE01和ILE02，摇瓶条件下菌株L-异亮氨酸产量分别提高17.3％(6.1 g/L)和9.6％(5.7 g/L)、发酵罐条件下分别提高11.7％(24.8 g/L)和8.1％(24.0 g/L).获得ppc基因组整合和质粒过表达菌株ILE03和ILE04，摇瓶条件下菌株L-异亮氨酸产量分别提高30.8％(6.8 g/L)和13.5％(5.9 g/L)、发酵罐条件下分别提高15.8％(25.7 g/L)和9.5％(24.3 g/L).此外，过表达pyc和ppc还可不同程度地提高L-异亮氨酸转化率.然而采用质粒过表达pyc和ppc均使得菌株生物量下降.因此，过表达pyc和ppc均能显著提高L-异亮氨酸产量和转化率，基因组整合的过表达方式效果优于质粒过表达.该研究首次比较并报道了增强谷氨酸棒杆菌回补途径对谷氨酸棒杆菌生产L-异亮氨酸的影响，可为其代谢工程改造提供参考....,朱福周 芦楠 李宇虹 林蓓蓓 郑颖楠 王子申 陈宁 张成林,0,2020年,14,http://www.wanfangdata.com.cn/link.do?url=BE78DC6926613EC3C61D070E578356F9C0FCD10AD4DC13D1A570C0F65213F934E7333D88E62F5656E4482B654AA454D40449AC4FCB6C7DE6905B5E2A39265CA8EE84777AE070E735B4E5F31E9DC5A3E7,N/A,N/A,N/A,万方期刊论文,增强回补途径对谷氨酸棒状杆菌合成L-异亮氨酸的影响
摘要：以L-异亮氨酸发酵过程的发酵液为样品，用偏最小二乘法考察2种光谱采集方式、7种光谱预处理方法及不同光谱波段选择对建立5种氨基酸光谱预测模型精度的影响.通过建立L-异亮氨酸发酵过程中主副产物最佳光谱预测模型，确定最佳光谱信息采集方式、光谱预处理方法、光谱波长范围及模型因子数.结果表明:反射扫描优于透射扫描获取光谱所建最佳预测模型;反射光谱采集L-异亮氨酸、L-丙氨酸、L-谷氨酸、L-亮氨酸和L-苏氨酸5种氨基酸最佳校正模型相关系数均大于0.96，其交互验证均方差分别为1.760，0.462，0.430，0.259，0.199，相对分析误差分别为7.8，6.8，6.3，5.0，6.4，表明所提出的近红外光谱分析法快速检测氨基酸发酵液中各成分稳定可行....,王森 王雪松 张昕 石国新 王健,0,2020年,7,http://www.wanfangdata.com.cn/link.do?url=BE78DC6926613EC3C61D070E578356F9C0FCD10AD4DC13D1A570C0F65213F934E7333D88E62F5656E4482B654AA454D40449AC4FCB6C7DE621431D5815D9147B900030DD8058F2A4EED9FB98CB098366194AD3731E07C78B,N/A,N/A,N/A,万方期刊论文,近红外光谱分析技术在监测L-异亮氨酸发酵过程中的应用
摘要：以谷氨酸棒杆菌(C orynebacterium glutam icum)23798为原始菌株，对其进行常温常压等离子体(A R TP)诱变，以磺胺胍抗性和氨基酸与茚三酮特异显色为筛选标记，以期得到高产L-异亮氨酸的诱变谷氨酸棒杆菌，并对其遗传稳定性进行研究.结果表明，原始菌株23798经过A R TP诱变处理180 s后，经0.4 m g/m L磺胺胍抗性筛选、多孔板高通量筛选、发酵培养复筛，选育出一株高产L-异亮氨酸诱变谷氨酸棒杆菌(C orynebacterium glutam icum)B 1.该菌株在摇瓶中发酵培养48 h，L-异亮氨酸产量达18.5 g/L，比原始菌株提高62.03％，且遗传性状稳定....,孔帅 陈敏 郑美娟 许鹏飞 吕育财 谢飞 周宜平 龚大春,1,2020年,10,http://www.wanfangdata.com.cn/link.do?url=BE78DC6926613EC3C61D070E578356F9C0FCD10AD4DC13D1A570C0F65213F934E7333D88E62F5656E4482B654AA454D40449AC4FCB6C7DE67926270CF98E56ECA9EE026917B66A11426149DF737403AA,N/A,N/A,N/A,万方期刊论文,常温常压等离子体诱变选育高产L-异亮氨酸谷氨酸棒杆菌
摘要：利用异氰酸丙基三乙氧基硅烷与L-异亮氨酸反应合成了一种新型的硅烷偶联剂，并进一步将其与硅胶反应制得键合有L-异亮氨酸的亲水色谱固定相.通过核磁共振氢谱表明亮氨酸功能化硅烷偶联剂的成功合成、元素分析表征证明亮氨酸已成功键合到硅胶表面.将其作为亲水模式下的固定相填料填装在150 mm×4.6 mm不锈钢色谱柱中，以一系列经典的极性小分子作为探针，考察了这些探针分子在固定相上的色谱行为.极性化合物的保留时间随着流动相中有机溶剂含量提高而逐渐增大，表现出典型的亲水保留特征.进一步研究了流动相中乙腈含量、缓冲盐pH值及缓冲盐浓度等因素对分析物在固定相上的保留的影响.在优化了相关参数后，将固定相应用于碱性化合物、水溶性维生素以及核苷类极性物质的分离当中.在等度洗脱下，5种碱性化合物、6种水溶性维生素和8种核苷类物质分别在8、18及25 min内被成功分离.分离结果表明了合成的L-异亮氨酸键合亲水色谱固定相具有较好的色谱性能，在极性化合物的分离上具有良好的应用前景....,成晓东 张铮,0,2020年,6,http://www.wanfangdata.com.cn/link.do?url=BE78DC6926613EC3C61D070E578356F9C0FCD10AD4DC13D1A570C0F65213F934E7333D88E62F5656E4482B654AA454D40449AC4FCB6C7DE6D976EFA8C7ECEC759D849B93D6B849EE08C3783EEA97DE0B,N/A,N/A,N/A,万方期刊论文,L-异亮氨酸键合色谱固定相的制备及其性能
摘要：旨在诱变选育L-异亮氨酸高产菌，并探索突变株最佳发酵条件.利用传统化学诱变结合常压室温等离子体生物诱变体系对实验室保藏的Brevibacterium flavum I-12进行逐级诱变，选育2-噻唑丙氨酸(2-TA)和磺胺胍(SG)高抗性和在琥珀酸平板上能快速生长的突变菌株.随后，在单因素实验的基础上，利用响应面设计优化出目的突变株摇瓶发酵培养基组分的最佳参数水平.结果显示，经过一系列诱变和筛选，成功选育出一株在40 g/L的2-TA和5 g/L的SG，且以琥珀酸为唯一碳源的培养基上快速生长突变株，命名为B.flavum TA-6，该菌株产酸达26.2±0.5 g/L，比出发菌株提高了44.75％，而副产物L-缬氨酸和L-亮氨酸积累量明显降低.经响应面法优化发酵条件后，突变株产酸可达27.8±0.5 g/L，比优化前提高了6.1％.通过传统化学诱变结合ARTP生物诱变体系，成功选育出一株杂酸降低的L-异亮氨酸高产菌TA-6，该菌株具有潜在生产应用价值....,王壮壮 魏佳 于海波 徐建中 张伟国,0,2020年,N/A,http://www.wanfangdata.com.cn/link.do?url=BE78DC6926613EC3C61D070E578356F9C0FCD10AD4DC13D1A570C0F65213F934E7333D88E62F5656E4482B654AA454D40449AC4FCB6C7DE6905B5E2A39265CA8FE8BC06820AD1AB3E0A9EC0B76C5D069,N/A,N/A,N/A,万方期刊论文,L-异亮氨酸高产菌选育及其培养基优化
摘要：[背景]L-异亮氨酸(L-isoleucine，L-Ile)和L-别异亮氨酸(L-allo-isoleucine，L-allo-Ile)是自然界中广泛存在的一对同分异构体.抗感染抗生素Desotamides结构中含L-别异亮氨酸结构单元，其生物合成途径中的氨基转移酶DsaD和异构酶DsaE可以协作催化L-异亮氨酸和L-别异亮氨酸相互转化.[目的]通过理性设计，使氨基转移酶DsaD和异构酶DsaE融合表达，研究融合蛋白DsaDE催化异亮氨酸和别异亮氨酸相互转化的功能.[方法]利用PCR分别扩增dsaE基因编码区DNA片段、以及含dsaD基因编码区和114个碱基接头序列的DNA片段dsaD-linker，利用酶切位点KpnⅠ将dsaE和dsaD-linker相连，形成dasDE重组序列，并克隆至pET28a(+)中，将重组质粒pET28a-dsaDE转化至Escherichia coli BL21 (DE3)中进行融合表达，利用Ni-NTA亲和层析法纯化融合蛋白DsaDE;分别以L-异亮氨酸和L-别异亮氨酸为底物进行融合蛋白的体外酶活性检测，利用高效液相色谱对酶反应产物进行分析.[结果]PCR验证、酶切验证以及测序结果证明pET28a-dsaDE重组载体具有正确序列;N-末端和C-末端融合6个组氨酸标签的融合蛋白DsaDE在E.coli BL21 (DE3)中获得可溶性表达，经Ni-NTA亲和层析法一步纯化获得纯度约95％的融合蛋白，纯化的融合蛋白DsaDE具有较好的活性，能够催化L-isoleucine和L-allo-isoleucine间的相互转化.[结论]氨基转移酶DsaD和异构酶DsaE成功融合表达，经一步Ni-NTA亲和层析法纯化即可获得纯度较高的融合蛋白，融合蛋白同时具有氨基转移酶和异构酶的活性，为进一步研究L-别异亮氨酸的工业化生产奠定了基础....,纪晓奇 李青连 鞠建华,0,2020年,N/A,http://www.wanfangdata.com.cn/link.do?url=BE78DC6926613EC3C61D070E578356F9C0FCD10AD4DC13D1A570C0F65213F934E7333D88E62F5656E4482B654AA454D40449AC4FCB6C7DE6E11CFAFBFB66F5D25EB5A99B8D109F84DE881069A7C99312,N/A,N/A,N/A,万方期刊论文,融合表达氨基转移酶DsaD和异构酶DsaE合成L-别异亮氨酸
摘要：对奇异变形杆菌Proteus mirabilis中的L-氨基酸脱氨酶进行定向进化，利用易错PCR技术向基因中引入随机突变，建立突变文库来筛选可获得较高α-酮-β-甲基正戊酸产量的突变株.突变株7/23-6最适全细胞转化反应条件是以pH 8.5 Tris-HC1为缓冲液，用900 mmol/L L-异亮氨酸在30℃下进行催化反应21～24 h，其α-酮-β-甲基正戊酸产量可以达到102 g/L，底物转化率达到87％.与对照菌相比，α-酮-β-甲基正戊酸产量和底物转化率均提高了13％，热稳定性提高了36.7％....,郭濛檬 刘龙 李江华 堵国成 陈坚,0,2020年,46,http://www.wanfangdata.com.cn/link.do?url=BE78DC6926613EC3C61D070E578356F9C0FCD10AD4DC13D1A570C0F65213F934E7333D88E62F5656E4482B654AA454D40449AC4FCB6C7DE6E11CFAFBFB66F5D2D94C04089A24E89C5AB2DF97604A28C8B201677D17A0C195,N/A,N/A,N/A,万方期刊论文,易错PCR法提高L-氨基酸脱氨酶全细胞转化L-异亮氨酸生产α-酮-β-甲基正戊酸效率
摘要：异亮氨酸在当今社会的应用越来越广泛，福建省麦丹生物集团有限公司福州研究中心对异亮氨酸的生产研究已有十多年的时间，在异亮氨酸生产菌株基础上进行研究，对于提高异亮氨酸的大罐生产水平具有一定的指导意义....,黄平,0,2020年,45,http://www.wanfangdata.com.cn/link.do?url=BE78DC6926613EC3C61D070E578356F9C0FCD10AD4DC13D1A570C0F65213F934E7333D88E62F5656E4482B654AA454D40449AC4FCB6C7DE6E17676849563A34D4C777E72E79A4A3023D8F680EF785127,N/A,N/A,N/A,万方期刊论文,L-异亮氨酸生产菌发酵水平提高的研究
摘要：4-羟基异亮氨酸(4-hydroxyisoleucine，4-HIL)具有促进胰岛素分泌、降低胰岛素抵抗活性功能，在治疗糖尿病方面有潜在的应用价值.在产L-异亮氨酸(L-isoleucine，Ile)的谷氨酸棒杆菌SN01菌株中过表达ido基因后可以合成4-HIL.为了促进草酰乙酸的供应和4-HIL合成，在这株重组菌中又过表达了mqo.发酵144 h后，ido-mqo过表达菌的4-HIL产量是(60.86±2.24) mmol/L，低于ido过表达菌(72.06±5.60)mmol/L;但是，Ile的积累量高达(101.39±2.20) mmol/L，显著高于ido过表达菌(5.00±1.43) mmol/L.对ido-mqo过表达菌代谢途径中部分关键基因的RT-PCR分析表明，进入TCA循环的碳流由异柠檬酸裂解酶分流，进入乙醛酸循环，导致4-HIL合成所需的另一底物α-酮戊二酸(α-ketoglutarate，α-KG)供应不足和Ile过剩.于是添加α-KG，当添加量为40 mmol/L时，4-HIL的产量提高到(77.7±10.91) mmol/L，Ile到4-HIL的转化率提高到75％.因此，过表达mqo能够促进Ile合成，添加o-KG后能够促进Ile向4-HIL转化，从而提高4-HIL产量....,卢正珂 史锋,0,2020年,22,http://www.wanfangdata.com.cn/link.do?url=BE78DC6926613EC3C61D070E578356F9C0FCD10AD4DC13D1A570C0F65213F934E7333D88E62F5656E4482B654AA454D40449AC4FCB6C7DE6905B5E2A39265CA83E6531A2D9FD14C354908907A489E4A4,N/A,N/A,N/A,万方期刊论文,过表达mqo对重组谷氨酸棒杆菌L-异亮氨酸和4-羟基异亮氨酸合成的影响
摘要：本发明属于L‑异亮氨酸生产技术领域，公开了一种L‑异亮氨酸的生产工艺，其包括如下步骤：步骤1）发酵，步骤2)浓缩重溶，步骤3)一次脱色，步骤4)二次脱色，步骤5)除杂和结晶。本发明生产工艺简单可行，提高了L‑异亮氨酸的产量和纯度。,N/A,N/A,2019-12-24,2,http://www.wanfangdata.com.cn/link.do?url=BE78DC6926613EC3C61D070E578356F9C0FCD10AD4DC13D1A570C0F65213F934E7333D88E62F5656E4482B654AA454D4312CDE92A525D0EC36CED29C7AFF8979E3989BFED6DD77441F7D8B4AEB67AFADB201677D17A0C195,N/A,冯世红,N/A,万方专利,一种L-异亮氨酸的生产工艺
摘要：本发明属于L‑异亮氨酸生产技术领域，公开了一种提高L‑异亮氨酸产量的方法，包括：其包括添加H2O2和葡萄糖营养液的步骤。本发明通过对发酵方法的优化，提高了L‑异亮氨酸的产量。,N/A,N/A,2019-12-10,0,http://www.wanfangdata.com.cn/link.do?url=BE78DC6926613EC3C61D070E578356F9C0FCD10AD4DC13D1A570C0F65213F934E7333D88E62F5656E4482B654AA454D4312CDE92A525D0EC36CED29C7AFF8979E3989BFED6DD77444DBBC33704DE2C4DB201677D17A0C195,N/A,冯世红,N/A,万方专利,一种提高L-异亮氨酸产量的方法
摘要：对黄色短杆菌突变株BM2610生产L-异亮氨酸的摇瓶发酵条件进行了研究.单因素优化了菌株BM2610的发酵培养基与培养条件，确定了发酵培养基的最佳碳氮源、最适起始pH、装液量及接种量等，进一步通过响应面分析方法优化了发酵培养基的组成配比.结果在优化条件下，BM2610摇瓶发酵平均积累L-异亮氨酸16.11 g·L-1，比未优化前提高了126.3％....,沈加彬 胡荣涛 罗磊 施碧红 吴松刚,2,2020年,N/A,http://www.wanfangdata.com.cn/link.do?url=BE78DC6926613EC3C61D070E578356F9C0FCD10AD4DC13D1A570C0F65213F934E7333D88E62F5656E4482B654AA454D40449AC4FCB6C7DE662A62A28B791BD2343E12A62FC9DA5707791B49B50044DAEB201677D17A0C195,N/A,N/A,N/A,万方期刊论文,响应面法优化L-异亮氨酸产生菌的摇瓶发酵条件
摘要：L-异亮氨酸在紫外光区无吸收峰，需将其进行衍生后才能测定.通过对比两种柱前衍生方法，建立高效液相色谱法柱前衍生检测L-异亮氨酸质量分数的方法.OPA自动衍生法检测耗时15 min，R=1，加标回收率99%~100.1%，RSD<1.0%;PITC手动衍生法检测耗时30 min，加标回收率96%~98%，RSD<1%.O PA自动衍生法在检测的时效性和准确性方面均具有明显优势，可用来高效地检测L-异亮氨酸的质量分数，在生物发酵、饲料添加剂、食品添加剂和制药等领域具有较高的应用价值....,唐艳 李晶 吴涛,3,2020年,57,http://www.wanfangdata.com.cn/link.do?url=BE78DC6926613EC3C61D070E578356F9C0FCD10AD4DC13D1A570C0F65213F934E7333D88E62F5656E4482B654AA454D40449AC4FCB6C7DE662A62A28B791BD239FB4A367D68A7AA3DE027707ACC20D5A,N/A,N/A,异亮氨酸;高效液相色谱;OPA;自动衍生;手动衍生,万方期刊论文,L-异亮氨酸高效液相色谱检测方法的研究
摘要：本发明公开了一种热稳定性与酶活提高的L‑异亮氨酸羟化酶突变体，具体公开了一种热稳定性与酶活提高的L‑异亮氨酸羟化酶突变体及其在4‑羟基异亮氨酸生产中的应用，属于基因工程技术领域。本发明提出的提高热稳定性的方法可用于其他羟化酶的改造，为生产其他高附加值羟化氨基酸提供了理论指导。利用本发明的的枯草芽孢杆菌工程菌生产得到的L‑异亮氨酸羟化酶的比酶活可达2.4±0.08U/mg，全细胞重复5批次，连续转化45h，可以得到856.91mM(126.1g/L)的4‑HIL，且5批次后，L‑异亮氨酸羟化酶的转化能力仍为第一次转化的84.1％。,N/A,N/A,2019-11-12,1,http://www.wanfangdata.com.cn/link.do?url=BE78DC6926613EC3C61D070E578356F9C0FCD10AD4DC13D1A570C0F65213F934E7333D88E62F5656E4482B654AA454D4312CDE92A525D0EC36CED29C7AFF8979E3989BFED6DD7744ACCFEF7A0BBD5457B201677D17A0C195,N/A,江南大学,N/A,万方专利,一种热稳定性与酶活提高的L-异亮氨酸羟化酶突变体
摘要：以L-异亮氨酸(L-ILe)为底物，以异源表达Fe(Ⅱ)/2-酮戊二酸依赖型双加氧酶的重组大肠杆菌BL21/pET28a-ido全细胞作为催化剂，催化合成4-羟基异亮氨酸(4-HIL).基于重组异亮氨酸双加氧酶(IDO)催化异亮氨酸羟基化的性质和条件，在摇瓶水平上对辅因子亚铁离子、 α-酮戊二酸(α-KG)及底物浓度进行了单因素优化.获得的最佳反应条件为2 g/L FeSO4·7H2 O，底物与α-KG摩尔比为1:1，该条件下反应8 h可生成190 mmol/L 4-HIL.结合摇瓶水平的最优条件，在反应器水平上继续对搅拌速度、 菌体浓度等进行优化，实现了对高底物浓度下催化反应的连续调控.在50 g/L湿菌体及400 r/min转速下可一次转化合成400 mmol/L 4-HIL，建立了全细胞催化合成4-羟基异亮氨酸的工艺流程....,张文丽 聂尧 景晓冉 徐岩,0,2020年,9,http://www.wanfangdata.com.cn/link.do?url=BE78DC6926613EC3C61D070E578356F9C0FCD10AD4DC13D1A570C0F65213F934E7333D88E62F5656E4482B654AA454D40449AC4FCB6C7DE60CD3398900D9ED97861BD2299B1A3FBF68C89722C0E55A5AB201677D17A0C195,N/A,N/A,N/A,万方期刊论文,Fe(Ⅱ)/2-酮戊二酸依赖型双加氧酶重组大肠杆菌全细胞催化合成4-羟基异亮氨酸
摘要：结合实验和分子模拟研究了L-异亮氨酸对L-丙氨酸晶体主要晶面生长速率的影响.实验发现随着溶液中L-异亮氨酸浓度的增加，L-丙氨酸(120)面(轴面)的生长速率显著降低，而(011)面(端面)的生长速率增加，导致L-丙氨酸晶体的长径比增大.分子模拟的结果表明，L-异亮氨酸容易占据L-丙氨酸(120)晶面的台阶位从而阻碍(120)晶面的生长;但其不仅不容易吸附于(011)晶面的台阶位，反而会促进溶质分子在溶剂化界面的扩散，从而提高(011)晶面的生长速率.分子模拟的结果较好地解释了实验中L-异亮氨酸对L-丙氨酸不同晶面具有不同作用效果的现象....,谭文绘 钱刚,0,2020年,N/A,http://www.wanfangdata.com.cn/link.do?url=BE78DC6926613EC3C61D070E578356F9C0FCD10AD4DC13D1A570C0F65213F934E7333D88E62F5656E4482B654AA454D40449AC4FCB6C7DE6E17676849563A34DAD247467AF2C4FA4D810D80BAC2D7980,N/A,N/A,L-丙氨酸;杂质;生长速率;分子模拟,万方期刊论文,L-异亮氨酸对L-丙氨酸晶体生长速率的影响
摘要：以L-苏氨酸生产菌Escherichia coli THRD为出发菌株，利用基因重组技术替换ilvLXGMEDA启动子并过表达解除L-异亮氨酸反馈抑制的ilvA和ilvIH，以期获得L-异亮氨酸生产菌.将ilvLXGMEDA启动子替换为强启动子Ptrc并敲除ilvLXGM后获得ILE01菌株，于该菌株中分别过表达解除L-异亮氨酸反馈抑制的ilvIH及共表达解除L-异亮氨酸反馈抑制的ilvA和ilvIH，获得菌株ILE02和ILE03，其L-异亮氨酸产量分别达到1.75 g/L和2.19g/L.针对ILE03 α-酮丁酸积累量过高的问题，通过改变操纵子中ilvA和ilvIH的顺序调节其转录水平，获得菌株ILE04，其L-异亮氨酸产量达2.85 g/L.利用ILE04于5L发酵罐中进行发酵实验，L-异亮氨酸产量、发酵强度及转化率分别为5.23 g/L、0.17 g/(L·h)及4.6％....,李燕军 张海宾 麻杰 张成林 谢希贤 陈宁,0,2020年,118,http://www.wanfangdata.com.cn/link.do?url=BE78DC6926613EC3C61D070E578356F9C0FCD10AD4DC13D1A570C0F65213F934E7333D88E62F5656E4482B654AA454D40449AC4FCB6C7DE662A62A28B791BD239FB4A367D68A7AA3CDAF45DE36D2103F,N/A,N/A,N/A,万方期刊论文,代谢工程改造大肠杆菌合成L-异亮氨酸的研究
摘要：本发明涉及一种生产L‑异亮氨酸的基因工程菌及其应用，属于代谢工程领域。所述基因工程菌是通过在宿主细胞中过表达解除L‑异亮氨酸反馈抑制乙酰羟酸合成酶编码基因ilvBNM、苏氨酸脱水酶编码基因ilvA以及苏氨酸操纵子thrABC获得，ilvBNM编码的乙酰羟酸合成酶在解除了L‑异亮氨酸对其的反馈抑制作用，且其活性较野生型ilvBN编码的乙酰羟酸合成酶未见明显降低；本发明所述的L‑异亮氨酸基因工程菌无营养缺陷、生长快、发酵周期短、产量高、转化率高，经过26‑36h发酵后，发酵液中的L‑异亮氨酸浓度达到42.5‑51.6g/L。,N/A,N/A,2019-10-08,0,http://www.wanfangdata.com.cn/link.do?url=BE78DC6926613EC3C61D070E578356F9C0FCD10AD4DC13D1A570C0F65213F934E7333D88E62F5656E4482B654AA454D4312CDE92A525D0EC36CED29C7AFF8979E3989BFED6DD77449967631112551B70B201677D17A0C195,N/A,天津科技大学,N/A,万方专利,一种生产L-异亮氨酸的基因工程菌及其应用
摘要：本发明公开了一种L‑异亮氨酸结晶制备工艺，步骤如下：常温下将L‑异亮氨酸加入到纯化水中，搅拌均匀，再加入亚硝酸，L‑异亮氨酸与亚硝酸的摩尔比为1∶1‑1.1，L‑异亮氨酸与水的重量比为1∶0.4；反应温度在40℃～70℃，溶液逐渐澄清，用亚硝酸调节溶液pH为1～2；溶液澄清后冷却至10℃～25℃，将析出的结晶进行固液分离；结晶物冲洗后于60℃～85℃干燥得L‑异亮氨酸亚硝酸盐成品，固液分离后的液体为母液继续循环使用。本发明一种L‑异亮氨酸结晶制备工艺，采用食品级的L‑异亮氨酸与化学试剂级的亚硝酸在常压下进行反应，反应条件温和，工艺合理简便，产品质量好纯度在99％以上。而且在生产中结晶后的母液可继续循环使用，收率高达到98％以上，适合工业化大生产。,N/A,N/A,2019-06-04,2,http://www.wanfangdata.com.cn/link.do?url=BE78DC6926613EC3C61D070E578356F9C0FCD10AD4DC13D1A570C0F65213F934E7333D88E62F5656E4482B654AA454D4312CDE92A525D0EC36CED29C7AFF8979AA0E7E23A28D33E6E674B18C4AF6265EB201677D17A0C195,N/A,张妮妮,N/A,万方专利,一种L-异亮氨酸结晶制备工艺
摘要：本发明提供了一种L‑异亮氨酸的分离纯化方法，属于生物工程领域。该方法包括以下步骤：(1)发酵液除杂：于L‑异亮氨酸发酵液中加入离子去除剂，加热后离心处理，得到上清液；(2)初步纯化：将步骤(1)所得上清液通过超滤膜进行超滤处理，得到滤清液；(3)高度纯化：将步骤(2)所得滤清液酸化处理后，加入001×7型强酸性苯乙烯系阳离子交换树脂动态吸附后，用洗脱剂洗脱，得到洗脱液；(4)结晶：调节步骤(3)所得洗脱液的pH值至7.5，加入乙醇进行结晶，真空干燥后得到L‑异亮氨酸。本发明能有效去除发酵液中的杂质，提高L‑异亮氨酸的提取率和品质，可广泛应用于L‑异亮氨酸的工业制备中。,N/A,N/A,2019-06-07,1,http://www.wanfangdata.com.cn/link.do?url=BE78DC6926613EC3C61D070E578356F9C0FCD10AD4DC13D1A570C0F65213F934E7333D88E62F5656E4482B654AA454D4312CDE92A525D0EC36CED29C7AFF8979E3989BFED6DD77449D01549594911FC2B201677D17A0C195,N/A,内蒙古拜克生物有限公司,N/A,万方专利,一种L-异亮氨酸的分离纯化方法
摘要：凤尾鱼酶解物(AFH)通过大孔树脂吸附处理后，发现DA201-C型大孔树脂为最佳吸附材料.在单因素实验基础上，以腥味、色泽和回收率为评价指标，运用正交实验L9(34)优化了DA201-C型大孔树脂对凤尾鱼酶解产物脱腥脱色工艺，得到最佳条件为:pH6，大孔树脂量5％，脱腥脱色时间1.5 h，以及温度25℃，该条件下感官评定综合评分为84.36.同时，研究表明脱腥脱色后，凤尾鱼酶解产物中牛磺酸、丙氨酸、甲硫氨酸和异亮氨酸呈显著性降低(P＜0.01)，挥发性物质成分中醛和含氮类化合物相对含量呈显著性降低....,盛洁 胡凌豪 陈建康 宋益善,0,2020年,0,http://www.wanfangdata.com.cn/link.do?url=BE78DC6926613EC3C61D070E578356F9C0FCD10AD4DC13D1A570C0F65213F934E7333D88E62F5656E4482B654AA454D40449AC4FCB6C7DE6905B5E2A39265CA82B09DD9867C831EFA320A74D0CFCB1B1,N/A,N/A,N/A,万方期刊论文,凤尾鱼酶解产物脱腥脱色工艺优化
摘要：本发明提供了一种L‑异亮氨酸的生产方法，涉及生物化工领域，将膜分离法、沉降法与离子交换法相结合，避免了膜处理法及离子交换法中膜及离子交换树脂易受污染的问题，并解决了发酵过程中废液铵氮含量高、反渗透膜处理过程及离子交换过程中使用大量酸碱及废液废弃问题，稳定、高效且环保，得到的L‑异亮氨酸具有高纯度及高产率的特点。,N/A,N/A,2019-03-22,4,http://www.wanfangdata.com.cn/link.do?url=BE78DC6926613EC3C61D070E578356F9C0FCD10AD4DC13D1A570C0F65213F934E7333D88E62F5656E4482B654AA454D4312CDE92A525D0EC36CED29C7AFF8979E3989BFED6DD7744FEFF2ABA709A89ABB201677D17A0C195,N/A,内蒙古拜克生物有限公司,N/A,万方专利,一种L-异亮氨酸的生产方法
